,Unnamed: 0,Unnamed: 0.1,Unnamed: 0.1.1,Unnamed: 0.1.1.1,Unnamed: 0.1.1.1.1,Unnamed: 0.1.1.1.1.1,title,paper_file,video_file,subtitle_file,video_url,data_imported
146,146.0,146.0,146.0,146.0,146.0,146.0,HoloBar: Rapid Command Execution for Head-Worn AR Exploiting Around the Field-of-View Interaction,,146.mp4,146.srt,https://www.youtube.com/watch?v=B9cFhQsYG3s,N
147,147.0,147.0,147.0,147.0,147.0,147.0,ThroughHand: 2D Tactile Interaction to Simultaneously Recognize and Touch Multiple Objects,,147.mp4,147.srt,https://www.youtube.com/watch?v=CeuWUhB6kFA,N
148,148.0,148.0,148.0,148.0,148.0,148.0,Community Based Robot Design for Classrooms with Mixed Visual Abilities Children,,148.mp4,148.srt,https://www.youtube.com/watch?v=rYux-mVThKA,N
149,149.0,149.0,149.0,149.0,149.0,149.0,Examining Visual Semantic Understanding in Blind and Low-Vision Technology Users,,149.mp4,149.srt,https://www.youtube.com/watch?v=cNYrKnTNIj4,N
150,150.0,150.0,150.0,150.0,150.0,150.0,Dynamic Field of View Restriction in 360º Video: Aligning Optical Flow and Visual SLAM to ...,,150.mp4,150.srt,https://www.youtube.com/watch?v=jeiq3dUQvUM,N
151,151.0,151.0,151.0,151.0,151.0,151.0,RepliCueAuth: Validating the Use of a Lab-Based Virtual Reality Setup for Evaluating ...,,151.mp4,151.srt,https://www.youtube.com/watch?v=3b6_9N-4iFI,N
152,152.0,152.0,152.0,152.0,152.0,152.0,Data Engagement Reconsidered: A Study of Automatic Stress TrackingTechnology in Use,,152.mp4,152.srt,https://www.youtube.com/watch?v=CYclaCYRnkc,N
153,153.0,153.0,153.0,153.0,153.0,153.0,Coping with Digital Wellbeing in a Multi-Device World,,153.mp4,153.srt,https://www.youtube.com/watch?v=s3VEgVAUtQs,N
154,154.0,154.0,154.0,154.0,154.0,154.0,Assessing Social Anxiety Through Digital Biomarkers Embedded in a Gaming Task,,154.mp4,154.srt,https://www.youtube.com/watch?v=wapkJbaKYP0,N
155,155.0,155.0,155.0,155.0,155.0,155.0,Living Memory Home: Understanding Continuing Bond in the Digital Age through Backstage Grieving,,155.mp4,155.srt,https://www.youtube.com/watch?v=_8LpMNGItk8,N
156,156.0,156.0,156.0,156.0,156.0,156.0,Designing for Emotional Well-being: Integrating Persuasion and Customization into Mental Health ...,,156.mp4,156.srt,https://www.youtube.com/watch?v=qBT-3A-zV4o,N
157,157.0,157.0,157.0,157.0,157.0,157.0,Personalised Recommendations in Mental Health Apps: The Impact of Autonomy and Data Sharing,,157.mp4,157.srt,https://www.youtube.com/watch?v=EAWaX6o6F9s,N
158,158.0,158.0,158.0,158.0,158.0,158.0,"""Can I Not Be Suicidal on a Sunday?"": Understanding Technology-Mediated Pathways to Mental ...",,158.mp4,158.srt,https://www.youtube.com/watch?v=UdlogIWBs0U,N
159,159.0,159.0,159.0,159.0,159.0,159.0,"A Review on Strategies for Data Collection, Reflection, and Communication in Eating Disorder Apps",,159.mp4,159.srt,https://www.youtube.com/watch?v=hELd1A_XRTI,N
160,160.0,160.0,160.0,160.0,160.0,160.0,Karamad: A Voice-based Crowd-sourcing Platform for Under-served Populations,,160.mp4,160.srt,https://www.youtube.com/watch?v=Mh22XUXfodE,N
161,161.0,161.0,161.0,161.0,161.0,161.0,Hardhats and Bungaloos: Comparing Crowdsourced Design Feedback with Peer Design Feedback in the ...,,161.mp4,161.srt,https://www.youtube.com/watch?v=iNXqAK6OwwU,N
162,162.0,162.0,162.0,162.0,162.0,162.0,Towards “Avatar-Friendly” 3D Manipulation Techniques: Bridging the Gap Between Sense of ...,,162.mp4,162.srt,https://www.youtube.com/watch?v=Je-LUFLFlJg,N
163,163.0,163.0,163.0,163.0,163.0,163.0,Articulating Soma Experiences using Trajectories,,163.mp4,163.srt,https://www.youtube.com/watch?v=7ACi7LS9mj4,N
164,164.0,164.0,164.0,164.0,164.0,164.0,Interoceptive Interaction: An Embodied Metaphor Inspired Approach to Designing for Meditation,,164.mp4,164.srt,https://www.youtube.com/watch?v=K2q1ybjRDIs,N
165,165.0,165.0,165.0,165.0,165.0,165.0,WallTokens: Surface Tangibles for Vertical Displays,,165.mp4,165.srt,https://www.youtube.com/watch?v=GYNHY6sdIME,N
166,166.0,166.0,166.0,166.0,166.0,166.0,DistanciAR: Authoring Site-Specific Augmented Reality Experiences for Remote Environments,,166.mp4,166.srt,https://www.youtube.com/watch?v=iI1fKnqfBVo,N
167,167.0,167.0,167.0,167.0,167.0,167.0,"Safety, Connection and Reflection: Designing with Therapists for Children with Serious Emotional ...",,167.mp4,167.srt,https://www.youtube.com/watch?v=03jjGUCWePU,N
168,168.0,168.0,168.0,168.0,168.0,168.0,Financial Technologies in the Cycle of Poor Mental Health and Financial Hardship: Towards ...,,168.mp4,168.srt,https://www.youtube.com/watch?v=qS1LKFUVWhg,N
169,169.0,169.0,169.0,169.0,169.0,169.0,“Money makes the world go around”: Identifying Barriers to Better Privacy in Children's Apps ...,,169.mp4,169.srt,https://www.youtube.com/watch?v=7cIlDDNNYHo,N
170,170.0,170.0,170.0,170.0,170.0,170.0,"Money Whispers: Informality, International Politics, and Immigration in Transnational Finance",,170.mp4,170.srt,https://www.youtube.com/watch?v=zWZk92OkTyI,N
171,171.0,171.0,171.0,171.0,171.0,171.0,Homecoming: Exploring Returns to Long-Term Single Player Games,,171.mp4,171.srt,https://www.youtube.com/watch?v=TrUUpMiPK_o,N
172,172.0,172.0,172.0,172.0,172.0,172.0,Wanting To Live Here: Design After Anthropocentric Functionalism,,172.mp4,172.srt,https://www.youtube.com/watch?v=DWfsvumqQMQ,N
173,173.0,173.0,173.0,173.0,173.0,173.0,PV-Pix: Slum Community Co-design of Self-Powered Deformable Smart Messaging Materials,,173.mp4,173.srt,https://www.youtube.com/watch?v=WstrSgf-XIs,N
174,174.0,174.0,174.0,174.0,174.0,174.0,A Decade of Sustainable HCI: Connecting SHCI to the Sustainable Development Goals,,174.mp4,174.srt,https://www.youtube.com/watch?v=KZNkZRiOBWM,N
175,175.0,175.0,175.0,175.0,175.0,175.0,Diagnosing Bias in the Gender Representation of HCI Research Participants: How it Happens and ...,,175.mp4,175.srt,https://www.youtube.com/watch?v=2yrxiYbeu78,N
176,176.0,176.0,176.0,176.0,176.0,176.0,Reducing Uncertainty and Offering Comfort: Designing Technology for Coping with Interpersonal Racism,,176.mp4,176.srt,https://www.youtube.com/watch?v=xZ4mjb3pFYc,N
177,177.0,177.0,177.0,177.0,177.0,177.0,Yes: Affirmative Consent as a Theoretical Framework for Understanding and Imagining Social Platforms,,177.mp4,177.srt,https://www.youtube.com/watch?v=eLxEG5qHIso,N
178,178.0,178.0,178.0,178.0,178.0,178.0,Caring for Intimate Data in Fertility Technologies,,178.mp4,178.srt,https://www.youtube.com/watch?v=UWLnMYJfCAI,N
179,179.0,179.0,179.0,179.0,179.0,179.0,"Selling Glossy, Easy Futures: A Feminist Exploration of Commercial Mental-Health-focused ...",,179.mp4,179.srt,https://www.youtube.com/watch?v=jfpHxBRjTrk,N
180,180.0,180.0,180.0,180.0,180.0,180.0,Getting Ourselves Together: Epistemic Burden and Data-centered Participatory Design Research,,180.mp4,180.srt,https://www.youtube.com/watch?v=ES0k1rjpBa8,N
181,181.0,181.0,181.0,181.0,181.0,181.0,The Technology Is Enemy for Me at the Moment: How Smart Home Technologies Assert Control Beyond ...,,181.mp4,181.srt,https://www.youtube.com/watch?v=Qy3Wa9bsa7Q,N
182,182.0,182.0,182.0,182.0,182.0,182.0,Developable Metamaterials: Mass-fabricable Metamaterials by Laser-Cutting Elastic Structures,,182.mp4,182.srt,https://www.youtube.com/watch?v=7HPJy-H8zWU,N
183,183.0,183.0,183.0,183.0,183.0,183.0,Assembler^3: 3D Reconstruction of Laser-cut Models,,183.mp4,183.srt,https://www.youtube.com/watch?v=bwFVzCEa82o,N
184,184.0,184.0,184.0,184.0,184.0,184.0,Creative Transactions: Special Digital Monies in ‘Break Kickstarter’ Crowdfunding Campaigns,,184.mp4,184.srt,https://www.youtube.com/watch?v=MrgGG7ZrDh4,N
185,185.0,185.0,185.0,185.0,185.0,185.0,Are Current Voice Interfaces Designed to Support Children's Language Development?,,185.mp4,185.srt,https://www.youtube.com/watch?v=u7aTVItQfIA,N
186,186.0,186.0,186.0,186.0,186.0,186.0,Lanterns: Configuring a Digital Resource to Inspire Preschool Children’s Free Play Outdoors,,186.mp4,186.srt,https://www.youtube.com/watch?v=HuBb465vQcA,N
187,187.0,187.0,187.0,187.0,187.0,187.0,A Critical Examination of Virtual Reality Technology in the Context of the Minority Body,,187.mp4,187.srt,https://www.youtube.com/watch?v=P820nUrH-Ag,N
188,188.0,188.0,188.0,188.0,188.0,188.0,"Techniques of Use: Confronting Value Systems of Productivity, Progress, and Usefulness in ...",,188.mp4,188.srt,https://www.youtube.com/watch?v=xgM9BeuMIyc,N
189,189.0,189.0,189.0,189.0,189.0,189.0,Perspectives of Bioartists and Community Lab Organizers on Working with Living Organisms,,189.mp4,189.srt,https://www.youtube.com/watch?v=xtQGdZK8NMQ,N
190,190.0,190.0,190.0,190.0,190.0,190.0,Eyecam: Revealing Relations between Humans and Sensing Devices through an Anthropomorphic Webcam,,190.mp4,190.srt,https://www.youtube.com/watch?v=p8wDzLT9fhM,N
191,191.0,191.0,191.0,191.0,191.0,191.0,Freeform Fabrication of Fluidic Edible Materials,,191.mp4,191.srt,https://www.youtube.com/watch?v=28K7nJZ2_lA,N
192,192.0,192.0,192.0,192.0,192.0,192.0,Making Un-Use: When Humans Disengage with Technology,,192.mp4,192.srt,https://www.youtube.com/watch?v=LgFNTF5TA2Y,N
193,193.0,193.0,193.0,193.0,193.0,193.0,How Design Researchers Interpret Probes: Understanding the Critical Intentions of a Designerly ...,,193.mp4,193.srt,https://www.youtube.com/watch?v=pBOxsvGYTK8,N
194,194.0,194.0,194.0,194.0,194.0,194.0,ArgueTutor: An Adaptive Dialog-based Learning System for Argumentation Skills,,194.mp4,194.srt,https://www.youtube.com/watch?v=IEdTK3NhC94,N
195,195.0,195.0,195.0,195.0,195.0,195.0,Designing CAST: A Computer-Assisted Shadowing Trainer for Self-Regulated Foreign Language ...,,195.mp4,195.srt,https://www.youtube.com/watch?v=obl-ZvrVS_g,N
196,196.0,196.0,196.0,196.0,196.0,196.0,Attitudes Surrounding an Imperfect AI Autograder,,196.mp4,196.srt,https://www.youtube.com/watch?v=8ePLY1IjqbI,N
197,197.0,197.0,197.0,197.0,197.0,197.0,U!Scientist: Designing for People-Powered Research in Museums,,197.mp4,197.srt,https://www.youtube.com/watch?v=tVCPZ68j88o,N
198,198.0,198.0,198.0,198.0,198.0,198.0,"Toggles, Dollar Signs, and Triangles: How to (In)Effectively Convey Privacy Choices",,198.mp4,198.srt,https://www.youtube.com/watch?v=QrrJYHc0yJQ,N
199,199.0,199.0,199.0,199.0,199.0,199.0,PriView -- Exploring Visualisations Supporting Users' Privacy Awareness,,199.mp4,199.srt,https://www.youtube.com/watch?v=vrWA04ytmeA,N
200,200.0,200.0,200.0,200.0,200.0,200.0,“Why lose control?” A Study of Freelancers' Experiences with Gig Economy Platforms,,200.mp4,200.srt,https://www.youtube.com/watch?v=fuDUOJmtzOg,N
201,201.0,201.0,201.0,201.0,201.0,201.0,To Live in Their Utopia: Why Algorithmic Systems Create Absurd Outcomes,,201.mp4,201.srt,https://www.youtube.com/watch?v=ujiVnaDngWg,N
202,202.0,202.0,202.0,202.0,202.0,202.0,Mapping the Landscape of COVID-19 Crisis Visualizations,,202.mp4,202.srt,https://www.youtube.com/watch?v=GaUQPf9pNkQ,N
203,203.0,203.0,203.0,203.0,203.0,203.0,Documented: Embedding Information onto and Retrieving Information from 3D Printed Objects,,203.mp4,203.srt,https://www.youtube.com/watch?v=I5mxoGwy3pI,N
204,204.0,204.0,204.0,204.0,204.0,204.0,AdolescentBot: Understanding Opportunities for Chatbots in Combating Adolescent Sexual and ...,,204.mp4,204.srt,https://www.youtube.com/watch?v=VaL9vYPPeqw,N
205,205.0,205.0,205.0,205.0,205.0,205.0,Understanding Trigger-Action Programs Through Novel Visualizations of Program Differences,,205.mp4,205.srt,https://www.youtube.com/watch?v=k8ldBtbvuKM,N
206,206.0,206.0,206.0,206.0,206.0,206.0,Physical Warm-up Games. Exploring the Potential of Play and Technology Design,,206.mp4,206.srt,https://www.youtube.com/watch?v=xD9P-kBwDRk,N
207,207.0,207.0,207.0,207.0,207.0,207.0,Auditing E-Commerce Platforms for Algorithmically Curated Vaccine Misinformation,,207.mp4,207.srt,https://www.youtube.com/watch?v=oVXvZiVmbzw,N
208,208.0,208.0,208.0,208.0,208.0,208.0,“Taking care of myself as long as I can”: How People with Dementia Configure Self-Management Systems,,208.mp4,208.srt,https://www.youtube.com/watch?v=C1_U7rSVLfg,N
209,209.0,209.0,209.0,209.0,209.0,209.0,Avatar-Mediated Communication in Social VR: An In-depth Exploration of Older Adult Interaction ...,,209.mp4,209.srt,https://www.youtube.com/watch?v=1M7vfTJfzt0,N
210,210.0,210.0,210.0,210.0,210.0,210.0,Coupling Simulation and Hardware for Interactive Circuit Debugging,,210.mp4,210.srt,https://www.youtube.com/watch?v=DaTZeOQc8mM,N
211,211.0,211.0,211.0,211.0,211.0,211.0,Mindless Attractor: A False-Positive Resistant Intervention for Drawing Attention Using Auditory ...,,211.mp4,211.srt,https://www.youtube.com/watch?v=MdjNM4f84A4,N
212,212.0,212.0,212.0,212.0,212.0,212.0,AdaptiFont: Increasing Individuals' Reading Speed with a Generative Font Model and Bayesian ...,,212.mp4,212.srt,https://www.youtube.com/watch?v=NQof-Kp5YM0,N
213,213.0,213.0,213.0,213.0,213.0,213.0,Fragments of the Past: Configuring Peer Support with Perpetrators of Domestic Violence,,213.mp4,213.srt,https://www.youtube.com/watch?v=2kToZZArN8s,N
214,214.0,214.0,214.0,214.0,214.0,214.0,Interaction Illustration Taxonomy: Classification of Styles and Techniques for Visually ...,,214.mp4,214.srt,https://www.youtube.com/watch?v=XxTyd5L77sY,N
215,215.0,215.0,215.0,215.0,215.0,215.0,Grand Challenges in Immersive Analytics,,215.mp4,215.srt,https://www.youtube.com/watch?v=_Rfy8o-nvHU,N
216,216.0,216.0,216.0,216.0,216.0,216.0,UISketch: A Large-Scale Dataset of UI Element Sketches,,216.mp4,216.srt,https://www.youtube.com/watch?v=32yug4-bnRs,N
217,217.0,217.0,217.0,217.0,217.0,217.0,Bolder is Better: Raising User Awareness through Salient and Concise Privacy Notices,,217.mp4,217.srt,https://www.youtube.com/watch?v=0Pgp6GiHhag,N
218,218.0,218.0,218.0,218.0,218.0,218.0,Appliancizer: Transforming Web Pages into Electronic Devices,,218.mp4,218.srt,https://www.youtube.com/watch?v=53LRpMp2_vM,N
219,219.0,219.0,219.0,219.0,219.0,219.0,'Why Are You Playing Games? You Are a Girl!': Exploring The Gender Biases of Male and Female in ...,,219.mp4,219.srt,https://www.youtube.com/watch?v=ibyKJ9lPick,N
220,220.0,220.0,220.0,220.0,220.0,220.0,Project Tasca : Enabling Touch and Contextual Interactions with a Pocket-based Textile Sensor,,220.mp4,220.srt,https://www.youtube.com/watch?v=L-War8GOlk4,N
221,221.0,221.0,221.0,221.0,221.0,221.0,Hummer: Text Entry by Gaze and Hum,,221.mp4,221.srt,https://www.youtube.com/watch?v=_eu91g5fTaw,N
222,222.0,222.0,222.0,222.0,222.0,222.0,PhraseFlow: Designs and Empirical Studies of Phrase-Level Input,,222.mp4,222.srt,https://www.youtube.com/watch?v=kEDXCczoag8,N
223,223.0,223.0,223.0,223.0,223.0,223.0,"""Everyone wants to do the model work, not the data work"": Data Cascades in High-Stakes AI",,223.mp4,223.srt,https://www.youtube.com/watch?v=D96uffvrxmo,N
224,224.0,224.0,224.0,224.0,224.0,224.0,Say It All: Feedback for Improving Non-Visual Presentation Accessibility,,224.mp4,224.srt,https://www.youtube.com/watch?v=AvXBiZ3C3yY,N
225,225.0,225.0,225.0,225.0,225.0,225.0,Who Is Included in Human Perceptions of AI?: Trust and Perceived Fairness around Healthcare AI ...,,225.mp4,225.srt,https://www.youtube.com/watch?v=X21gcGlp12s,N
226,226.0,226.0,226.0,226.0,226.0,226.0,Touch&Fold: A Foldable Haptic Actuator for Rendering Touch in Mixed Reality,,226.mp4,226.srt,https://www.youtube.com/watch?v=dfztK7e0Ics,N
227,227.0,227.0,227.0,227.0,227.0,227.0,Go Gig or Go Home: Enabling Social Sensing to Share Personal Data with Intimate Partner for the ...,,227.mp4,227.srt,https://www.youtube.com/watch?v=MkiDaCujjNQ,N
228,228.0,228.0,228.0,228.0,228.0,228.0,TweakIt: Supporting End-User Programmers Who Transmogrify Code,,228.mp4,228.srt,https://www.youtube.com/watch?v=pBP68mpFSW0,N
229,229.0,229.0,229.0,229.0,229.0,229.0,SEMOUR: Scripted EMOtional speech repository for URdu,,229.mp4,229.srt,https://www.youtube.com/watch?v=MaXNt4MVTgo,N
230,230.0,230.0,230.0,230.0,230.0,230.0,Proxemics and Social Interactions in an Instrumented Virtual Reality Workshop,,230.mp4,230.srt,https://www.youtube.com/watch?v=vwa5vKfBWUU,N
231,231.0,231.0,231.0,231.0,231.0,231.0,"Flow Encourages Task Focus, but Frustration Drives Task Switching: How Reward and Effort Combine ...",,231.mp4,231.srt,https://www.youtube.com/watch?v=9IDx9u67G74,N
232,232.0,232.0,232.0,232.0,232.0,232.0,AdapTutAR: an Adaptive Tutoring System for Machine Tasks using Augmented Reality,,232.mp4,232.srt,https://www.youtube.com/watch?v=-LumVZu7BT4,N
233,233.0,233.0,233.0,233.0,233.0,233.0,Galileo: Citizen-led Experimentation Using a Social Computing System,,233.mp4,233.srt,https://www.youtube.com/watch?v=RXYXEOzwPeI,N
234,234.0,234.0,234.0,234.0,234.0,234.0,Crowdsourcing More Effective Initializations for Single-Target Trackers Through Automatic ...,,234.mp4,234.srt,https://www.youtube.com/watch?v=DOFgZc92450,N
235,235.0,235.0,235.0,235.0,235.0,235.0,Dark Patterns and the Legal Requirements of Consent Banners: An Interaction Criticism Perspective,,235.mp4,235.srt,https://www.youtube.com/watch?v=jYPuTYPq-FI,N
236,236.0,236.0,236.0,236.0,236.0,236.0,Towards Understanding How Readers Integrate Charts and Captions: A Case Study with Line Charts,,236.mp4,236.srt,https://www.youtube.com/watch?v=in-hIJaH55c,N
237,237.0,237.0,237.0,237.0,237.0,237.0,Standing in the Way of Control: A Call to Action to Prevent Abuse through Better Design of Smart ...,,237.mp4,237.srt,https://www.youtube.com/watch?v=A4CNeptzFXQ,N
238,238.0,238.0,238.0,238.0,238.0,238.0,"Priorities, Technology & Power: Co-Designing an Inclusive Transit Agenda in Kampala, Uganda",,238.mp4,238.srt,https://www.youtube.com/watch?v=4A7uie97omA,N
239,239.0,239.0,239.0,239.0,239.0,239.0,"Examining the Intersections of Race, Religion & Community Technologies: A Photovoice Study",,239.mp4,239.srt,https://www.youtube.com/watch?v=KytJtYku5Xk,N
240,240.0,240.0,240.0,240.0,240.0,240.0,CASSIE: Curve and Surface Sketching in Immersive Environments,,240.mp4,240.srt,https://www.youtube.com/watch?v=F3aI6QPKShI,N
241,241.0,241.0,241.0,241.0,241.0,241.0,“Turning the Invisible Visible”: Transdisciplinary Bioart Explorations in Human-DNA Interaction,,241.mp4,241.srt,https://www.youtube.com/watch?v=tYwyQ9cMDmk,N
242,242.0,242.0,242.0,242.0,242.0,242.0,Flower Jelly Printer: Slit Injection Printing for Parametrically Designed Flower Jelly,,242.mp4,242.srt,https://www.youtube.com/watch?v=8P3bfmRbrxo,N
243,243.0,243.0,243.0,243.0,243.0,243.0,Exploring User-Centered Security Design for Usable Authentication Ceremonies,,243.mp4,243.srt,https://www.youtube.com/watch?v=cHoDTVv4mpM,N
244,244.0,244.0,244.0,244.0,244.0,244.0,Fighting Fires and Powering Steam Locomotives: Distribution of Control and Its Role in Social ...,,244.mp4,244.srt,https://www.youtube.com/watch?v=5eFW7IY6wPU,N
245,245.0,245.0,245.0,245.0,245.0,245.0,"Technology Adoption and Learning Preferences for Older Adults: Evolving Perceptions, Ongoing ...",,245.mp4,245.srt,https://www.youtube.com/watch?v=1NZfuBSl6cU,N
246,246.0,246.0,246.0,246.0,246.0,246.0,Personal Jacquard Weaving,,246.mp4,246.srt,https://www.youtube.com/watch?v=DIBcBHc5His,N
247,247.0,247.0,247.0,247.0,247.0,247.0,Serious Snacking: A Survival Analysis of how Snacking Mechanics Affect Attrition in a Mobile ...,,247.mp4,247.srt,https://www.youtube.com/watch?v=QbzmJJlEOCs,N
248,248.0,248.0,248.0,248.0,248.0,248.0,Applying Critical Voice in Design of User Interfaces for Supporting Self-Reflection and Emotion ...,,248.mp4,248.srt,https://www.youtube.com/watch?v=KFW7kjpzbqQ,N
249,249.0,249.0,249.0,249.0,249.0,249.0,"Chasing Luck: Data-driven Prediction, Faith, Hunch, and Cultural Norms in Rural Betting Practices",,249.mp4,249.srt,https://www.youtube.com/watch?v=zH_mwW_vPQM,N
250,250.0,250.0,250.0,250.0,250.0,250.0,Fostering Equitable Help-Seeking for K-3 Students in Low Income and Rural Contexts,,250.mp4,250.srt,https://www.youtube.com/watch?v=nLcIaSneQK4,N
251,251.0,251.0,251.0,251.0,251.0,251.0,Scrappy: Using Scrap Material as Infill To Make Fabrication More Sustainable,,251.mp4,251.srt,https://www.youtube.com/watch?v=fxsQAd9JlPc,N
252,252.0,252.0,252.0,252.0,252.0,252.0,"""It's Just Everything Outside of the IDE that's the Problem"": Information Seeking by Software ...",,252.mp4,252.srt,https://www.youtube.com/watch?v=SCP_7fu0yjI,N
253,253.0,253.0,253.0,253.0,253.0,253.0,Ninja Hands: Using Many Hands to Improve Target Selection in VR,,253.mp4,253.srt,https://www.youtube.com/watch?v=sG4ZlyuSXKU,N
254,254.0,254.0,254.0,254.0,254.0,254.0,CoCapture: Effectively Communicating UI Behaviors on Existing Websites by Demonstrating and Remixing,,254.mp4,254.srt,https://www.youtube.com/watch?v=nOBavIlFqTk,N
255,255.0,255.0,255.0,255.0,255.0,255.0,Breaking out of the Lab: Mitigating Mind Wandering with Gaze-Based Attention-Aware Technology in ...,,255.mp4,255.srt,https://www.youtube.com/watch?v=ZX6XkuIJ640,N
256,256.0,256.0,256.0,256.0,256.0,256.0,Seeing is Believing: Exploring Perceptual Differences in DeepFake Videos,,256.mp4,256.srt,https://www.youtube.com/watch?v=Mq8v5JRZTLU,N
257,257.0,257.0,257.0,257.0,257.0,257.0,Using Boolean Satisfiability Solvers to Help Reduce Cognitive Load and Improve Decision Making ...,,257.mp4,257.srt,https://www.youtube.com/watch?v=haN0CeasdJQ,N
258,258.0,258.0,258.0,258.0,258.0,258.0,Can You Hear My Heartbeat?: Hearing an Expressive Biosignal Elicits Empathy,,258.mp4,258.srt,https://www.youtube.com/watch?v=7N9GOKW1mbA,N
259,259.0,259.0,259.0,259.0,259.0,259.0,BodyStylus: Freehand On-Skin Design and Fabrication of Epidermal Interfaces,,259.mp4,259.srt,https://www.youtube.com/watch?v=fBY8kmwUnvg,N
260,260.0,260.0,260.0,260.0,260.0,260.0,"Understanding, Detecting and Mitigating the Effects of Coactivations in Ten-Finger Mid-Air ...",,260.mp4,260.srt,https://www.youtube.com/watch?v=1I3rTIzboGQ,N
261,261.0,261.0,261.0,261.0,261.0,261.0,Uncovering the Promises and Challenges of Social Media Use in the Low-Wage Labor Market: ...,,261.mp4,261.srt,https://www.youtube.com/watch?v=kXepQAYIhOM,N
262,262.0,262.0,262.0,262.0,262.0,262.0,Eliciting Tech Futures Among Black Young Adults: A Case Study of Remote Speculative Co-Design,,262.mp4,262.srt,https://www.youtube.com/watch?v=329AtOGSpak,N
263,263.0,263.0,263.0,263.0,263.0,263.0,Beyond Expertise and Roles: A Framework to Characterize the Stakeholders of Interpretable ...,,263.mp4,263.srt,https://www.youtube.com/watch?v=CGbKmlTzRLI,N
264,264.0,264.0,264.0,264.0,264.0,264.0,Off-Peak: An Examination of Ordinary Player Experience,,264.mp4,264.srt,https://www.youtube.com/watch?v=ClUAbrABPqk,N
265,265.0,265.0,265.0,265.0,265.0,265.0,The Effects of System Interpretation Errors on Learning New Input Mechanisms,,265.mp4,265.srt,https://www.youtube.com/watch?v=7ncFwLMyzR4,N
266,266.0,266.0,266.0,266.0,266.0,266.0,Viral Visualizations: How Coronavirus Skeptics Use Orthodox Data Practices to Promote Unorthodox ...,,266.mp4,266.srt,https://www.youtube.com/watch?v=zVlwJQu8pRo,N
267,267.0,267.0,267.0,267.0,267.0,267.0,Avoiding the Turing Tarpit: Learning Conversational Programming by Starting from Code's Purpose,,267.mp4,267.srt,https://www.youtube.com/watch?v=WJdjZKZEY9g,N
268,268.0,268.0,268.0,268.0,268.0,268.0,Sustaining a Networked Community Resource: Findings from a Longitudinal Situated Display Deployment,,268.mp4,268.srt,https://www.youtube.com/watch?v=uKme3NPbKsA,N
269,269.0,269.0,269.0,269.0,269.0,269.0,FastForce: Real-Time Reinforcement of Laser-Cut Structures,,269.mp4,269.srt,https://www.youtube.com/watch?v=uKjo3-_DajU,N
270,270.0,270.0,270.0,270.0,270.0,270.0,KnitUI: Fabricating Textile Sensor and User Interface with Machine Knitting,,270.mp4,270.srt,https://www.youtube.com/watch?v=gC8_bgS2Hvw,N
271,271.0,271.0,271.0,271.0,271.0,271.0,"""Brilliant AI Doctor"" in Rural Clinics: Challenges in AI-Powered Clinical Decision Support ...",,271.mp4,271.srt,https://www.youtube.com/watch?v=SOKsA9hVT1A,N
272,272.0,272.0,272.0,272.0,272.0,272.0,Your Photo is so Funny that I don’t Mind Violating Your Privacy by Sharing it:  Effects of ...,,272.mp4,272.srt,https://www.youtube.com/watch?v=L67PkBjIlrk,N
273,273.0,273.0,273.0,273.0,273.0,273.0,"Privacy Champions in Software Teams: Understanding Their Motivations, Strategies, and Challenges",,273.mp4,273.srt,https://www.youtube.com/watch?v=Cwc6aoodQ0w,N
274,274.0,274.0,274.0,274.0,274.0,274.0,Surfacing the Voices of People with Dementia: Strategies for Effective Inclusion of Proxy ...,,274.mp4,274.srt,https://www.youtube.com/watch?v=t19SjXbM9Ro,N
275,275.0,275.0,275.0,275.0,275.0,275.0,Winder: Linking Speech and Visual Objects to Support Communication in Asynchronous Collaboration,,275.mp4,275.srt,https://www.youtube.com/watch?v=_Y0d_uyA6XA,N
276,276.0,276.0,276.0,276.0,276.0,276.0,Enhancing the Composition Task in Text Entry Studies: Eliciting Difficult Text and Improving ...,,276.mp4,276.srt,https://www.youtube.com/watch?v=qx68DNCCZfk,N
277,277.0,277.0,277.0,277.0,277.0,277.0,"Market, Testbed, Backroom: The Redacted Internet of Facebook's Discover",,277.mp4,277.srt,https://www.youtube.com/watch?v=MgdNTval1hk,N
278,278.0,278.0,278.0,278.0,278.0,278.0,Exploring the Use of a Voice-based Conversational Agent to Empower Adolescents with Autism ...,,278.mp4,278.srt,https://www.youtube.com/watch?v=eJtAmli5TIU,N
279,279.0,279.0,279.0,279.0,279.0,279.0,Let’s Frets! Assisting Guitar Students during Practice via Capacitive Sensing,,279.mp4,279.srt,https://www.youtube.com/watch?v=YhLuCpgnaBg,N
280,280.0,280.0,280.0,280.0,280.0,280.0,Empowering Dyads of Older Adults With Mild Cognitive Impairment And Their Care Partners Using ...,,280.mp4,280.srt,https://www.youtube.com/watch?v=N-HMK5-WOoc,N
281,281.0,281.0,281.0,281.0,281.0,281.0,"What Makes a ""Bad"" Ad? User Perceptions of Problematic Online Advertising",,281.mp4,281.srt,https://www.youtube.com/watch?v=TEcWSkX8GoI,N
282,282.0,282.0,282.0,282.0,282.0,282.0,Understanding Conversational and Expressive Style in a Multimodal Embodied Conversational Agent,,282.mp4,282.srt,https://www.youtube.com/watch?v=Rjj1s7rau58,N
