,Unnamed: 0,Unnamed: 0.1,Unnamed: 0.1.1,Unnamed: 0.1.1.1,Unnamed: 0.1.1.1.1,Unnamed: 0.1.1.1.1.1,title,paper_file,video_file,subtitle_file,video_url,data_imported
0,0.0,0.0,0.0,0.0,0.0,0.0,Human Perceptions on Moral Responsibility of AI: A Case Study in AI-Assisted Bail Decision-Making,,0.mp4,0.srt,https://www.youtube.com/watch?v=YeUy7gaFm48,N
1,1.0,1.0,1.0,1.0,1.0,1.0,Engineering Multifunctional Spacer Fabrics Through Machine Knitting,,1.mp4,1.srt,https://www.youtube.com/watch?v=J1Yg2L5mydo,N
2,2.0,2.0,2.0,2.0,2.0,2.0,Design and Analysis of Intelligent Text Entry Systems with Function Structure Models and ...,,2.mp4,2.srt,https://www.youtube.com/watch?v=Ra-leaCUwKU,N
3,3.0,3.0,3.0,3.0,3.0,3.0,"Nuanced Perspectives Toward Disability Simulations from Digital Designers, Blind, Low Vision, ...",,3.mp4,3.srt,https://www.youtube.com/watch?v=rSqdz4xU_s4,N
4,4.0,4.0,4.0,4.0,4.0,4.0,From FOMO to JOMO: Examining the Fear and Joy of Missing Out and Presence in a 360° Video ...,,4.mp4,4.srt,https://www.youtube.com/watch?v=8q8MdWbvSQk,N
5,5.0,5.0,5.0,5.0,5.0,5.0,Combining Touchscreens with Passive Rich-ID Building Blocks to Support Context Construction in ...,,5.mp4,5.srt,https://www.youtube.com/watch?v=V5b_9ssT38o,N
6,6.0,6.0,6.0,6.0,6.0,6.0,Drone in Love: Emotional Perception of Facial Expressions on Flying Robots,,6.mp4,6.srt,https://www.youtube.com/watch?v=ZmdKzEh07Q8,N
7,7.0,7.0,7.0,7.0,7.0,7.0,Bedtime Window: A Field Study Connecting Bedrooms of Long-Distance Couples Using a Slow ...,,7.mp4,7.srt,https://www.youtube.com/watch?v=tTbQGPz4asY,N
8,8.0,8.0,8.0,8.0,8.0,8.0,Effect of Information Presentation on Fairness Perceptions of Machine Learning Predictors,,8.mp4,8.srt,https://www.youtube.com/watch?v=zYfbe4StZ6w,N
9,9.0,9.0,9.0,9.0,9.0,9.0,Latte: Use-Case and Assistive-Service Driven Automated Accessibility Testing Framework for Android,,9.mp4,9.srt,https://www.youtube.com/watch?v=Z84jeO0UZFE,N
10,10.0,10.0,10.0,10.0,10.0,10.0,Virtual Camera Layout Generation using a Reference Video,,10.mp4,10.srt,https://www.youtube.com/watch?v=r-fda3BJkH0,N
11,11.0,11.0,11.0,11.0,11.0,11.0,Illustrating the Gaps and Needs in the Training Support of Community Health Workers in India,,11.mp4,11.srt,https://www.youtube.com/watch?v=12iZBdJRBuA,N
12,12.0,12.0,12.0,12.0,12.0,12.0,'We Can Send a Man To The Moon But We Can't Control the Temperature In Our office'; A ...,,12.mp4,12.srt,https://www.youtube.com/watch?v=scCs91xD8h8,N
13,13.0,13.0,13.0,13.0,13.0,13.0,A Design Space Exploration of Worlds in Miniature,,13.mp4,13.srt,https://www.youtube.com/watch?v=bTdS8YCVVxI,N
14,14.0,14.0,14.0,14.0,14.0,14.0,Acceptability of Speech and Silent Speech Input Methods in Private and Public,,14.mp4,14.srt,https://www.youtube.com/watch?v=e0SlpfRTwIM,N
15,15.0,15.0,15.0,15.0,15.0,15.0,Adapting User Interfaces with Model-based Reinforcement Learning,,15.mp4,15.srt,https://www.youtube.com/watch?v=CyI3SnBNk3s,N
16,16.0,16.0,16.0,16.0,16.0,16.0,Does Clickbait Actually Attract More Clicks? Three Clickbait studies you must read,,16.mp4,16.srt,https://www.youtube.com/watch?v=EhjBUfmBjj8,N
17,17.0,17.0,17.0,17.0,17.0,17.0,Towards Fairness in Practice: A Practitioner-Oriented Rubric for Evaluating Fair ML Toolkits,,17.mp4,17.srt,https://www.youtube.com/watch?v=VkWflNn8jOg,N
18,18.0,18.0,18.0,18.0,18.0,18.0,Understanding the Role of Technology to Support Breastfeeding,,18.mp4,18.srt,https://www.youtube.com/watch?v=4-DcPxyngUs,N
19,19.0,19.0,19.0,19.0,19.0,19.0,Designing Ground Truth and the Social Life of Labels,,19.mp4,19.srt,https://www.youtube.com/watch?v=VCekWh19TTU,N
20,20.0,20.0,20.0,20.0,20.0,20.0,"The Annoying, the Disturbing, and the Weird: Challenges with Phone Numbers as Identifiers and ...",,20.mp4,20.srt,https://www.youtube.com/watch?v=SuYs7CBK6HI,N
21,21.0,21.0,21.0,21.0,21.0,21.0,`Unmochon': A Tool to Combat Online Sexual Harassment over Facebook Messenger,,21.mp4,21.srt,https://www.youtube.com/watch?v=2clF-gQnYp0,N
22,22.0,22.0,22.0,22.0,22.0,22.0,Digital Design Marginalization: New Perspectives on Designing Inclusive Interfaces,,22.mp4,22.srt,https://www.youtube.com/watch?v=OUKFSWVhYxQ,N
23,23.0,23.0,23.0,23.0,23.0,23.0,AI as Social Glue: Uncovering the Roles of Deep Generative AI during Social Music Composition,,23.mp4,23.srt,https://www.youtube.com/watch?v=JRl2XRltlLY,N
24,24.0,24.0,24.0,24.0,24.0,24.0,VisiFit: Structuring Iterative Improvement for Novice Designers,,24.mp4,24.srt,https://www.youtube.com/watch?v=5GJwkGhb6DI,N
25,25.0,25.0,25.0,25.0,25.0,25.0,Quantitative Data Visualisation on Virtual Globes,,25.mp4,25.srt,https://www.youtube.com/watch?v=YChLrxlL8ss,N
26,26.0,26.0,26.0,26.0,26.0,26.0,Gesture Knitter: A Hand Gesture Design Tool for Head-Mounted Mixed Reality Applications,,26.mp4,26.srt,https://www.youtube.com/watch?v=jF-GAvYUR7Y,N
27,27.0,27.0,27.0,27.0,27.0,27.0,"TapNet: The Design, Training, Implementation, and Applications of a Multi-Task Learning CNN for ...",,27.mp4,27.srt,https://www.youtube.com/watch?v=s1jduCY5Cvc,N
28,28.0,28.0,28.0,28.0,28.0,28.0,Investigating the Accessibility of Crowdwork Tasks on Mechanical Turk,,28.mp4,28.srt,https://www.youtube.com/watch?v=F1bUcqQ67Lo,N
29,29.0,29.0,29.0,29.0,29.0,29.0,TexYZ: Embroidering Enameled Wires for Three Degree-of-Freedom Mutual Capacitive Sensing,,29.mp4,29.srt,https://www.youtube.com/watch?v=auhm2XZkskM,N
30,30.0,30.0,30.0,30.0,30.0,30.0,Understanding Tilt in Esports: A Study of Young League of Legends Players,,30.mp4,30.srt,https://www.youtube.com/watch?v=xIF9IJdvDbI,N
31,31.0,31.0,31.0,31.0,31.0,31.0,Virtual Reality Esports - Understanding Competitive Players' Perceptions of Location Based VR ...,,31.mp4,31.srt,https://www.youtube.com/watch?v=UKDSTQ3EMp4,N
32,32.0,32.0,32.0,32.0,32.0,32.0,Stereo-Smell via Electrical Trigeminal Stimulation,,32.mp4,32.srt,https://www.youtube.com/watch?v=mVeOtmvZbiI,N
33,33.0,33.0,33.0,33.0,33.0,33.0,Ungrounded Vari-Dimensional Tactile Fingertip Feedback for Virtual Object Interaction,,33.mp4,33.srt,https://www.youtube.com/watch?v=LLbqQQEGzKQ,N
34,34.0,34.0,34.0,34.0,34.0,34.0,Optimal Action-based or User Prediction-based Haptic Guidance: Can You Do Even Better?,,34.mp4,34.srt,https://www.youtube.com/watch?v=Sl6XT9mhIvY,N
35,35.0,35.0,35.0,35.0,35.0,35.0,Examining Mobility Among People Living with HIV in Rural Areas,,35.mp4,35.srt,https://www.youtube.com/watch?v=zv3g-nOYKm4,N
36,36.0,36.0,36.0,36.0,36.0,36.0,From Detectables to Inspectables: Understanding Qualitative Analysis of Audiovisual Data,,36.mp4,36.srt,https://www.youtube.com/watch?v=QM8SmArEOBM,N
37,37.0,37.0,37.0,37.0,37.0,37.0,"Trade-offs for Substituting a Human with an Agent in a Pair Programming Context: The Good, the ...",,37.mp4,37.srt,https://www.youtube.com/watch?v=fel1sjI2pqM,N
38,38.0,38.0,38.0,38.0,38.0,38.0,"Designers Characterize Naturalness in Voice User Interfaces: Their Goals, Practices, and Challenges",,38.mp4,38.srt,https://www.youtube.com/watch?v=bzwkep-XpiI,N
39,39.0,39.0,39.0,39.0,39.0,39.0,Impact of Task on Attentional Tunneling in Handheld Augmented Reality,,39.mp4,39.srt,https://www.youtube.com/watch?v=SurgIJUxxjs,N
40,40.0,40.0,40.0,40.0,40.0,40.0,AffectiveSpotlight: Facilitating the Communication of Affective Responses from Audience Members ...,,40.mp4,40.srt,https://www.youtube.com/watch?v=Q7slR-dICYo,N
41,41.0,41.0,41.0,41.0,41.0,41.0,To Disclose or Not to Disclose: Examining the Privacy Decision-Making Processes of Older vs. ...,,41.mp4,41.srt,https://www.youtube.com/watch?v=GNQuX8yjMJo,N
42,42.0,42.0,42.0,42.0,42.0,42.0,Provocations from #vanlife: Investigating Life and Work in a Community Extensively Using ...,,42.mp4,42.srt,https://www.youtube.com/watch?v=cOnRDfP1cso,N
43,43.0,43.0,43.0,43.0,43.0,43.0,ASL Sea Battle: Gamifying Sign Language Data Collection,,43.mp4,43.srt,https://www.youtube.com/watch?v=XIujPZRca7Q,N
44,44.0,44.0,44.0,44.0,44.0,44.0,Detecting and Defending Against Seizure-Inducing GIFs in Social Media,,44.mp4,44.srt,https://www.youtube.com/watch?v=rD1p_2EHq3Y,N
45,45.0,45.0,45.0,45.0,45.0,45.0,Interpretable Program Synthesis,,45.mp4,45.srt,https://www.youtube.com/watch?v=v5scz1bzQN8,N
46,46.0,46.0,46.0,46.0,46.0,46.0,Augmented Reality and Older Adults: A Comparison of Prompting Types,,46.mp4,46.srt,https://www.youtube.com/watch?v=RKyUKlWnmg0,N
47,47.0,47.0,47.0,47.0,47.0,47.0,Domestic Robots and the Dream of Automation: Understanding Human Interaction and Intervention,,47.mp4,47.srt,https://www.youtube.com/watch?v=QLj1ZxJDsSE,N
48,48.0,48.0,48.0,48.0,48.0,48.0,Increasing Electrical Muscle Stimulation’s Dexterity by means of Back of the Hand Actuation,,48.mp4,48.srt,https://www.youtube.com/watch?v=koKGNzxlQ4E,N
49,49.0,49.0,49.0,49.0,49.0,49.0,Eliciting and Analysing Users' Envisioned Dialogues with Perfect Voice Assistants,,49.mp4,49.srt,https://www.youtube.com/watch?v=emkrXdUcUag,N
50,50.0,50.0,50.0,50.0,50.0,50.0,Optimization-based User Support for Cinematographic Quadrotor Camera Target Framing,,50.mp4,50.srt,https://www.youtube.com/watch?v=_9B-Smqc8wE,N
51,51.0,51.0,51.0,51.0,51.0,51.0,Understanding User Identification in Virtual Reality through Behavioral Biometrics and the ...,,51.mp4,51.srt,https://www.youtube.com/watch?v=R41hPt0pga0,N
52,52.0,52.0,52.0,52.0,52.0,52.0,Large Scale Analysis of Multitasking Behavior During Remote Meetings,,52.mp4,52.srt,https://www.youtube.com/watch?v=fTedGOcLL-c,N
53,53.0,53.0,53.0,53.0,53.0,53.0,How WEIRD is CHI?,,53.mp4,53.srt,https://www.youtube.com/watch?v=Ev8IOaQz9wo,N
54,54.0,54.0,54.0,54.0,54.0,54.0,IGScript: An Interaction Grammar for Scientific Data Presentation,,54.mp4,54.srt,https://www.youtube.com/watch?v=QTv-fNYVQsI,N
55,55.0,55.0,55.0,55.0,55.0,55.0,Spatial Labeling: Leveraging Spatial Layout for Improving Label Quality in Non-Expert Image ...,,55.mp4,55.srt,https://www.youtube.com/watch?v=-3XSott1tno,N
56,56.0,56.0,56.0,56.0,56.0,56.0,AtaTouch: Robust Finger Pinch Detection for a VR Controller Using RF Return Loss,,56.mp4,56.srt,https://www.youtube.com/watch?v=xsB1tJGKl6g,N
57,57.0,57.0,57.0,57.0,57.0,57.0,"Online Mingling: Supporting Ad Hoc, Private Conversations at Virtual Conferences",,57.mp4,57.srt,https://www.youtube.com/watch?v=LyMgx2p0TF0,N
58,58.0,58.0,58.0,58.0,58.0,58.0,Accessibility of High-Fidelity Prototyping Tools,,58.mp4,58.srt,https://www.youtube.com/watch?v=rJPGzIKPX90,N
59,59.0,59.0,59.0,59.0,59.0,59.0,Towards the Right Direction in BiDirectional User Interfaces,,59.mp4,59.srt,https://www.youtube.com/watch?v=5j9UO4Frv6M,N
60,60.0,60.0,60.0,60.0,60.0,60.0,Leaving the Field: Designing a Socio-Material Toolkit for Teachers to Continue to Design ...,,60.mp4,60.srt,https://www.youtube.com/watch?v=lJZe7FgahQI,N
61,61.0,61.0,61.0,61.0,61.0,61.0,"People May Punish, Not Blame, Robots",,61.mp4,61.srt,https://www.youtube.com/watch?v=dWUC0hq2RWY,N
62,62.0,62.0,62.0,62.0,62.0,62.0,#StayHome #WithMe: How Do YouTubers Help With COVID-19 Loneliness?,,62.mp4,62.srt,https://www.youtube.com/watch?v=CBLHNjdTf38,N
63,63.0,63.0,63.0,63.0,63.0,63.0,What Do We See in Them? Identifying Dimensions of Partner Models for Speech Interfaces Using a ...,,63.mp4,63.srt,https://www.youtube.com/watch?v=Rg2a_8Hq5rs,N
64,64.0,64.0,64.0,64.0,64.0,64.0,Spacewalker: Rapid UI Design Exploration Using Lightweight Markup Enhancement and Crowd Genetic ...,,64.mp4,64.srt,https://www.youtube.com/watch?v=1EuYXCepPo8,N
65,65.0,65.0,65.0,65.0,65.0,65.0,Mediating Intimacy with DearBoard: a Co-Customizable Keyboard for Everyday Messaging,,65.mp4,65.srt,https://www.youtube.com/watch?v=hgPL86aaz5Y,N
66,66.0,66.0,66.0,66.0,66.0,66.0,What Are You Doing With Your Phone?: How Social Class Frames Parent-Teen Tensions around Teens’ ...,,66.mp4,66.srt,https://www.youtube.com/watch?v=CSVPi7VMmm8,N
67,67.0,67.0,67.0,67.0,67.0,67.0,"Online Transgender Health Information Seeking: Facilitators, Barriers, and Future Directions",,67.mp4,67.srt,https://www.youtube.com/watch?v=ARDVWSgjGKY,N
68,68.0,68.0,68.0,68.0,68.0,68.0,Nudge for Reflection: More than Just a Channel to Political Knowledge,,68.mp4,68.srt,https://www.youtube.com/watch?v=RPmJihWWgik,N
69,69.0,69.0,69.0,69.0,69.0,69.0,What Players Want: Information Needs of Players on Post-GameVisualizations,,69.mp4,69.srt,https://www.youtube.com/watch?v=Ml3hBlv2PtM,N
70,70.0,70.0,70.0,70.0,70.0,70.0,Problem-Solving Efficiency and Cognitive Load for Adaptive Parsons Problems vs. Writing the ...,,70.mp4,70.srt,https://www.youtube.com/watch?v=XSSvS1vJDdI,N
71,71.0,71.0,71.0,71.0,71.0,71.0,Exploring Augmented Visual Alterations in Interpersonal Communication,,71.mp4,71.srt,https://www.youtube.com/watch?v=Mhlem-U439Q,N
72,72.0,72.0,72.0,72.0,72.0,72.0,"""It's About Missing Much More Than the People"": How Students use Digital Technologies to ...",,72.mp4,72.srt,https://www.youtube.com/watch?v=W_KL9xzUSAs,N
73,73.0,73.0,73.0,73.0,73.0,73.0,When the Social Becomes Non-Human: A Study of Young People’s Perception of Social Support in ...,,73.mp4,73.srt,https://www.youtube.com/watch?v=fDSIogTzj1w,N
74,74.0,74.0,74.0,74.0,74.0,74.0,Explainable Automatic Evaluation of the Trail Making Test for Dementia Screening,,74.mp4,74.srt,https://www.youtube.com/watch?v=_NzNRY_oMEE,N
75,75.0,75.0,75.0,75.0,75.0,75.0,KiTT - The Kinaesthetics Transfer Teacher: Design and Evaluation of a Tablet-based System to ...,,75.mp4,75.srt,https://www.youtube.com/watch?v=2PaeOK5hwHQ,N
76,76.0,76.0,76.0,76.0,76.0,76.0,Health Data in Fertility Care: An Ecological Perspective,,76.mp4,76.srt,https://www.youtube.com/watch?v=mNW_i_vZJe8,N
77,77.0,77.0,77.0,77.0,77.0,77.0,Understanding the Security and Privacy Advice Given to Black Lives Matter Protesters,,77.mp4,77.srt,https://www.youtube.com/watch?v=KnISF4GkZmk,N
78,78.0,78.0,78.0,78.0,78.0,78.0,Little Road Driving HUD: Heads-Up Display Complexity Influences Drivers’ Perceptions of ...,,78.mp4,78.srt,https://www.youtube.com/watch?v=R1K3ftXhZFs,N
79,79.0,79.0,79.0,79.0,79.0,79.0,Should Robots Blush?,,79.mp4,79.srt,https://www.youtube.com/watch?v=rprv2kJvbLs,N
80,80.0,80.0,80.0,80.0,80.0,80.0,Effective Interfaces for Student-Driven Revision Sessions for Argumentative Writing,,80.mp4,80.srt,https://www.youtube.com/watch?v=ZdeDn0Xm2xE,N
81,81.0,81.0,81.0,81.0,81.0,81.0,"Spreadsheet Comprehension: Guesswork, Giving up and Going back to the Author",,81.mp4,81.srt,https://www.youtube.com/watch?v=qPxGhm-Xr4w,N
82,82.0,82.0,82.0,82.0,82.0,82.0,Lower is Better? The Effects of Local Latencies on Competitive First-Person Shooter Game Players,,82.mp4,82.srt,https://www.youtube.com/watch?v=JWcH8uRRf6k,N
83,83.0,83.0,83.0,83.0,83.0,83.0,Improving Viewing Experiences of First-Person Shooter Gameplays with Automatically-Generated ...,,83.mp4,83.srt,https://www.youtube.com/watch?v=LOTX7vMjJTg,N
84,84.0,84.0,84.0,84.0,84.0,84.0,UMLAUT: Debugging Deep Learning Programs using Program Structure and Model Behavior,,84.mp4,84.srt,https://www.youtube.com/watch?v=K1ZujYpLhhw,N
85,85.0,85.0,85.0,85.0,85.0,85.0,Haptic and Visual Comprehension of a 2D Graph Layout Through Physicalisation,,85.mp4,85.srt,https://www.youtube.com/watch?v=qXjeWKDQX6E,N
86,86.0,86.0,86.0,86.0,86.0,86.0,Circumspect Users: Older Adults’ as Critical Adopters and Resistors of Technology,,86.mp4,86.srt,https://www.youtube.com/watch?v=Cg3blG6ofi4,N
87,87.0,87.0,87.0,87.0,87.0,87.0,BackTrack: 2D Back-of-device Interaction Through Front Touchscreen,,87.mp4,87.srt,https://www.youtube.com/watch?v=jPpxvu-1AMI,N
88,88.0,88.0,88.0,88.0,88.0,88.0,Investigating the Homogenization of Web Design: A Mixed-Methods Approach,,88.mp4,88.srt,https://www.youtube.com/watch?v=QREOEwvCoZ0,N
89,89.0,89.0,89.0,89.0,89.0,89.0,The Landscape and Gaps in Open Source Fairness Toolkits,,89.mp4,89.srt,https://www.youtube.com/watch?v=0poelmDzPpg,N
90,90.0,90.0,90.0,90.0,90.0,90.0,Data-Centric Explanations: Explaining Training Data of Machine Learning Systems to Promote ...,,90.mp4,90.srt,https://www.youtube.com/watch?v=pURSOBUP0KY,N
91,91.0,91.0,91.0,91.0,91.0,91.0,A User-Oriented Approach to Space-Adaptive Augmentation: The Effects of Spatial Affordance on ...,,91.mp4,91.srt,https://www.youtube.com/watch?v=1oJfnP_9pR0,N
92,92.0,92.0,92.0,92.0,92.0,92.0,Leveraging Text-Chart Links to Support Authoring of Data-Driven Articles with VizFlow,,92.mp4,92.srt,https://www.youtube.com/watch?v=qCb3aw7pQXo,N
93,93.0,93.0,93.0,93.0,93.0,93.0,Styling Words: A Simple and Natural Way to Increase Variability in Training Data Collection for ...,,93.mp4,93.srt,https://www.youtube.com/watch?v=1de7zxBseps,N
94,94.0,94.0,94.0,94.0,94.0,94.0,"""I...Got my Nose-Print. But it Wasn't Accurate"": How People with Upper Extremity Impairment ...",,94.mp4,94.srt,https://www.youtube.com/watch?v=AqAUvg-T83w,N
95,95.0,95.0,95.0,95.0,95.0,95.0,Manipulating and Measuring Model Interpretability,,95.mp4,95.srt,https://www.youtube.com/watch?v=OCYTLkQOV2E,N
96,96.0,96.0,96.0,96.0,96.0,96.0,"""That courage to encourage"": Participation and Aspirations in Chat-based Peer Support for Youth ...",,96.mp4,96.srt,https://www.youtube.com/watch?v=Ojpl9Hz7zn4,N
97,97.0,97.0,97.0,97.0,97.0,97.0,Comparing Generic and Community-Situated Crowdsourcing for Data Validation in the Context of ...,,97.mp4,97.srt,https://www.youtube.com/watch?v=_j4EEmY_HBY,N
98,98.0,98.0,98.0,98.0,98.0,98.0,Empowering Resignation: There's an App for That,,98.mp4,98.srt,https://www.youtube.com/watch?v=UuHHscXx1U8,N
99,99.0,99.0,99.0,99.0,99.0,99.0,CHI Against Bullying,,99.mp4,99.srt,https://www.youtube.com/watch?v=v6H3SBiC4Fs,N
100,100.0,100.0,100.0,100.0,100.0,100.0,Sticky Goals: Understanding Goal Commitments for Behavioral Changes in the Wild,,100.mp4,100.srt,https://www.youtube.com/watch?v=mSCXgOceCpA,N
101,101.0,101.0,101.0,101.0,101.0,101.0,BackSwipe: Back-of-device Word-Gesture Interaction on Smartphones,,101.mp4,101.srt,https://www.youtube.com/watch?v=oQQP5n7mu-U,N
102,102.0,102.0,102.0,102.0,102.0,102.0,LociMotion: Towards Learning a Strong Authentication Secret in a Single Session,,102.mp4,102.srt,https://www.youtube.com/watch?v=U5C3XPQ1frg,N
103,103.0,103.0,103.0,103.0,103.0,103.0,Beyond Show of Hands: Engaging Viewers via Expressive and Scalable Visual Communication in Live ...,,103.mp4,103.srt,https://www.youtube.com/watch?v=KNOKBl1rX7c,N
104,104.0,104.0,104.0,104.0,104.0,104.0,CoNotate: Suggesting Queries Based on Notes Promotes Knowledge Discovery,,104.mp4,104.srt,https://www.youtube.com/watch?v=wepHIba5jsc,N
105,105.0,105.0,105.0,105.0,105.0,105.0,What do Teens Make of Personal Informatics? Young People's Responses to Self-Tracking Practices ...,,105.mp4,105.srt,https://www.youtube.com/watch?v=XEHnDB1UvMo,N
106,106.0,106.0,106.0,106.0,106.0,106.0,"Tea, Earl Grey, Hot: Designing Speech Interactions from the Imagined Ideal of Star Trek",,106.mp4,106.srt,https://www.youtube.com/watch?v=DjGvY9Cigww,N
107,107.0,107.0,107.0,107.0,107.0,107.0,Evaluating an App to Promote a Better Visit Through Shared Activities for People Living with ...,,107.mp4,107.srt,https://www.youtube.com/watch?v=XnLjU5nJxlc,N
108,108.0,108.0,108.0,108.0,108.0,108.0,Overlooking context: How do Defaults and Framing Reduce Deliberation in Smart Home Privacy ...,,108.mp4,108.srt,https://www.youtube.com/watch?v=q_w2XlPaDLM,N
109,109.0,109.0,109.0,109.0,109.0,109.0,Modeling and Leveraging Analytic Focus During Exploratory Visual Analysis,,109.mp4,109.srt,https://www.youtube.com/watch?v=kTEtWzRkHs0,N
110,110.0,110.0,110.0,110.0,110.0,110.0,Chasing Play on TikTok from Populations with Disabilities to Inspire Playful and Inclusive ...,,110.mp4,110.srt,https://www.youtube.com/watch?v=DdF52VYop8w,N
111,111.0,111.0,111.0,111.0,111.0,111.0,Interaction Pace and User Preferences,,111.mp4,111.srt,https://www.youtube.com/watch?v=00zPq_MKTpM,N
112,112.0,112.0,112.0,112.0,112.0,112.0,Firefox Voice: An Open and Extensible Voice Assistant Built Upon the Web,,112.mp4,112.srt,https://www.youtube.com/watch?v=U6e758x2FV8,N
113,113.0,113.0,113.0,113.0,113.0,113.0,Constructing Embodied Algebra by Sketching,,113.mp4,113.srt,https://www.youtube.com/watch?v=6T6odSw2wHs,N
114,114.0,114.0,114.0,114.0,114.0,114.0,"FlexTruss: A Computational Threading Method for Multi-material, Multi-form and Multi-use Prototyping",,114.mp4,114.srt,https://www.youtube.com/watch?v=tG-3kM0DYQA,N
115,115.0,115.0,115.0,115.0,115.0,115.0,"Unmaking: Enabling and Celebrating the Creative Material of Failure, Destruction, Decay, and ...",,115.mp4,115.srt,https://www.youtube.com/watch?v=9qTWJCaF5RM,N
116,116.0,116.0,116.0,116.0,116.0,116.0,RobotAR: An Augmented Reality Compatible Teleconsulting Robotics Toolkit for Augmented ...,,116.mp4,116.srt,https://www.youtube.com/watch?v=0jbZ4gf7NzI,N
117,117.0,117.0,117.0,117.0,117.0,117.0,Cody: An AI-Based System to Semi-Automate Coding for Qualitative Research,,117.mp4,117.srt,https://www.youtube.com/watch?v=9Yr__2aYb0c,N
118,118.0,118.0,118.0,118.0,118.0,118.0,Shing: A Conversational Agent to Alert Customers of Suspected Online-payment Fraud with ...,,118.mp4,118.srt,https://www.youtube.com/watch?v=wiMYj0iXCmY,N
119,119.0,119.0,119.0,119.0,119.0,119.0,Towards Mutual Theory of Mind in Human-AI Interaction: How Language Reflects What Students ...,,119.mp4,119.srt,https://www.youtube.com/watch?v=Kv9WibAk3zk,N
120,120.0,120.0,120.0,120.0,120.0,120.0,Fits and Starts: Enterprise Use of AutoML and the Role of Humans in the Loop,,120.mp4,120.srt,https://www.youtube.com/watch?v=1ftEYAMGVVY,N
121,121.0,121.0,121.0,121.0,121.0,121.0,Can Anthropographics Promote Prosociality? A Review and Large-Sample Study,,121.mp4,121.srt,https://www.youtube.com/watch?v=ragNhZnWXSQ,N
122,122.0,122.0,122.0,122.0,122.0,122.0,The Public Life of Data: Investigating Reactions to Visualizations on Reddit,,122.mp4,122.srt,https://www.youtube.com/watch?v=kr7ntnsCLIc,N
123,123.0,123.0,123.0,123.0,123.0,123.0,The Development and Validation of the Technology-Supported Reflection Inventory,,123.mp4,123.srt,https://www.youtube.com/watch?v=ll4Llwie4Is,N
124,124.0,124.0,124.0,124.0,124.0,124.0,How the Design of YouTube Influences User Sense of Agency,,124.mp4,124.srt,https://www.youtube.com/watch?v=3blV3Jy_Uow,N
125,125.0,125.0,125.0,125.0,125.0,125.0,Data Agents:  Promoting Reflection through Meaningful Representations of Personal Data in ...,,125.mp4,125.srt,https://www.youtube.com/watch?v=UYEaFe-js0k,N
126,126.0,126.0,126.0,126.0,126.0,126.0,Exploring a Feedback-Oriented Design Process Through Curved Folding,,126.mp4,126.srt,https://www.youtube.com/watch?v=ID9n2EUocec,N
127,127.0,127.0,127.0,127.0,127.0,127.0,"What Makes a Dark Pattern... Dark? Design Attributes, Normative Considerations, and Measurement ...",,127.mp4,127.srt,https://www.youtube.com/watch?v=vM3FJqno61A,N
128,128.0,128.0,128.0,128.0,128.0,128.0,Limited control over the body as intriguing play design resource,,128.mp4,128.srt,https://www.youtube.com/watch?v=KCnPPuS4kjA,N
129,129.0,129.0,129.0,129.0,129.0,129.0,Exploring the Design Space of Immersive Social Fitness Games: The ImSoFit Games Model,,129.mp4,129.srt,https://www.youtube.com/watch?v=XweWc2mh7GE,N
130,130.0,130.0,130.0,130.0,130.0,130.0,Towards the Next Generation of Gaming Wearables,,130.mp4,130.srt,https://www.youtube.com/watch?v=4FPN4Vekgk8,N
131,131.0,131.0,131.0,131.0,131.0,131.0,Restraints as a Mechanic for Bodily Play,,131.mp4,131.srt,https://www.youtube.com/watch?v=VBvmCAHM5Ng,N
132,132.0,132.0,132.0,132.0,132.0,132.0,Streaming VR Games to the Broad Audience: A Comparison of the First-Person and Third-Person ...,,132.mp4,132.srt,https://www.youtube.com/watch?v=LY44F7oQI8g,N
133,133.0,133.0,133.0,133.0,133.0,133.0,How should AI Systems Talk to users when Collecting their Personal Information? Effects of Role ...,,133.mp4,133.srt,https://www.youtube.com/watch?v=GVrlv5jbYes,N
134,134.0,134.0,134.0,134.0,134.0,134.0,Calibrating Pedestrians' Trust in Automated Vehicles: Does an Intent Display in an External HMI ...,,134.mp4,134.srt,https://www.youtube.com/watch?v=tGP50wa3EQg,N
135,135.0,135.0,135.0,135.0,135.0,135.0,PinpointFly: An Egocentric Position-control Drone Interface using Mobile AR,,135.mp4,135.srt,https://www.youtube.com/watch?v=A1yZ2PVTtTM,N
136,136.0,136.0,136.0,136.0,136.0,136.0,Learning from Healthcare Providers' Strategies: Designing Technology to Support Effective Child ...,,136.mp4,136.srt,https://www.youtube.com/watch?v=kFa7gTKVUM4,N
137,137.0,137.0,137.0,137.0,137.0,137.0,Taking an (Embodied) Cue From Community Health: Designing Dementia Caregiver Support Technology ...,,137.mp4,137.srt,https://www.youtube.com/watch?v=2V0m4sLbiHQ,N
138,138.0,138.0,138.0,138.0,138.0,138.0,Touch without Touching: Overcoming Social Distancing in Semi-Intimate Relationships with SansTouch,,138.mp4,138.srt,https://www.youtube.com/watch?v=5-V-W5QOz4s,N
139,139.0,139.0,139.0,139.0,139.0,139.0,"Scraps: Enabling Mobile Capture, Contextualization, and Use of Document Resources",,139.mp4,139.srt,https://www.youtube.com/watch?v=xPWw_b5VuGg,N
140,140.0,140.0,140.0,140.0,140.0,140.0,Distress Disclosure across Social Media Platforms during the COVID-19 Pandemic: Untangling the ...,,140.mp4,140.srt,https://www.youtube.com/watch?v=QfaKJCJ88kI,N
141,141.0,141.0,141.0,141.0,141.0,141.0,IM Receptivity and Presentation-type Preferences among Users of a Mobile App with Automated ...,,141.mp4,141.srt,https://www.youtube.com/watch?v=5BISZQMDSeA,N
142,142.0,142.0,142.0,142.0,142.0,142.0,“I Got Some Free Time”: Investigating Task-execution and Task-effort Metrics in Mobile ...,,142.mp4,142.srt,https://www.youtube.com/watch?v=O-y07DUBg0M,N
143,143.0,143.0,143.0,143.0,143.0,143.0,Facilitating Text Entry on Smartphones with QWERTY Keyboard for Users with Parkinson’s Disease,,143.mp4,143.srt,https://www.youtube.com/watch?v=ybO8s9XOcOk,N
144,144.0,144.0,144.0,144.0,144.0,144.0,Elbow-Anchored Interaction: Designing Restful Mid-Air Input,,144.mp4,144.srt,https://www.youtube.com/watch?v=syJC5qg3SZY,N
145,145.0,145.0,145.0,145.0,145.0,145.0,SonicHoop: Using Interactive Sonification to Support Aerial Hoop Practices,,145.mp4,145.srt,https://www.youtube.com/watch?v=rJlH-zvBytA,N
