,Unnamed: 0,Unnamed: 0.1,Unnamed: 0.1.1,Unnamed: 0.1.1.1,Unnamed: 0.1.1.1.1,Unnamed: 0.1.1.1.1.1,title,paper_file,video_file,subtitle_file,video_url,data_imported
572,572.0,572.0,,,,,Communicating with Motion: A Design Space for Animated Visual Narratives in Data Videos,,572.mp4,572.srt,https://www.youtube.com/watch?v=scORw5QbMgg,N
573,573.0,573.0,,,,,Blending into Everyday Life: Designing a Social Media-Based Peer Support System,,573.mp4,573.srt,https://www.youtube.com/watch?v=srkSbUjPZ2A,N
574,574.0,574.0,,,,,Reading in VR: The Effect of Text Presentation Type and Location,,574.mp4,574.srt,https://www.youtube.com/watch?v=SOse2xDvY6Y,N
575,575.0,575.0,,,,,A Probabilistic Interpretation of Motion Correlation Selection Techniques,,575.mp4,575.srt,https://www.youtube.com/watch?v=DJGa_sswuf8,N
576,576.0,576.0,,,,,Students' Verbalized Metacognition during Computerized Learning,,576.mp4,576.srt,https://www.youtube.com/watch?v=wWYoler_CPg,N
577,577.0,577.0,,,,,Toward Automatic Audio Description Generation for Accessible Videos,,577.mp4,577.srt,https://www.youtube.com/watch?v=gjHXw6iHWqA,N
578,578.0,578.0,,,,,Soma-noti: Delivering Notifications Through Under Clothing Wearables,,578.mp4,578.srt,https://www.youtube.com/watch?v=iCcrrL2XXu8,N
579,579.0,579.0,,,,,Designing Effective Interview Chatbots: Automatic Chatbot Profiling and Design Suggestion ...,,579.mp4,579.srt,https://www.youtube.com/watch?v=2KUWqYYPYDc,N
580,580.0,580.0,,,,,"Feeling Colours: Investigating Crossmodal Correspondences Between 3D Shapes, Colours and Emotions",,580.mp4,580.srt,https://www.youtube.com/watch?v=QwKvjWsEjDs,N
581,581.0,581.0,,,,,HulaMove: Using Commodity IMU for Waist Interaction,,581.mp4,581.srt,https://www.youtube.com/watch?v=W8MoKTT_akw,N
582,582.0,582.0,,,,,AdverTiming Matters: Examining User Ad Consumption for Effective Ad Allocations on Social Media,,582.mp4,582.srt,https://www.youtube.com/watch?v=Cj12Qi1DTlk,N
583,583.0,583.0,,,,,Experiencing Simulated Confrontations in Virtual Reality,,583.mp4,583.srt,https://www.youtube.com/watch?v=bp_E3P97KXg,N
584,584.0,584.0,,,,,Understanding the Usage of Online Media for Parenting from Infancy to Preschool At Scale,,584.mp4,584.srt,https://www.youtube.com/watch?v=8HebZAsaPR4,N
585,585.0,585.0,,,,,It's So Difficult to Sever that Connection: The Role of FoMO in Users' Reluctant Privacy Behaviours,,585.mp4,585.srt,https://www.youtube.com/watch?v=_806sAPPmn8,N
586,586.0,586.0,,,,,"Us and Them (and It): Social Orientation, Privacy Concerns, and Expected Use of ...",,586.mp4,586.srt,https://www.youtube.com/watch?v=6YkI8WwfNuc,N
587,587.0,587.0,,,,,The Effects of Warmth and Competence Perceptions on Users' Choice of an AI System,,587.mp4,587.srt,https://www.youtube.com/watch?v=SE2J-M7bogQ,N
588,588.0,588.0,,,,,Fabricaide: Fabrication-Aware Design for 2D Cutting Machines,,588.mp4,588.srt,https://www.youtube.com/watch?v=cnW42Y6rGzs,N
589,589.0,589.0,,,,,Integrating Machine Learning Data  with Symbolic Knowledge from Collaboration Practices of ...,,589.mp4,589.srt,https://www.youtube.com/watch?v=bj6haVYl5yE,N
590,590.0,,,,,,Buying the 'Right' Thing: Designing Food Recommender Systems with Critical Consumers,,590.mp4,590.srt,https://www.youtube.com/watch?v=H6eFmLGTFHQ,N
591,591.0,,,,,,"Expressivity in Interaction, a Framework for Design",,591.mp4,591.srt,https://www.youtube.com/watch?v=eL48dcsyPMc,N
592,592.0,,,,,,Designing a Conversational Agent for Sexual Assault Survivors: Defining Burden of ...,,592.mp4,592.srt,https://www.youtube.com/watch?v=OKnrwKHXybA,N
593,593.0,,,,,,“We Just Use What They Give Us”: Understanding Passenger User Perspectives in Smart Homes,,593.mp4,593.srt,https://www.youtube.com/watch?v=c1-j9yS_PFc,N
594,594.0,,,,,,Queuing for Waste: Sociotechnical Interactions within a Food Sharing Community,,594.mp4,594.srt,https://www.youtube.com/watch?v=JKPp0Jxt1F8,N
595,595.0,,,,,,An Examination of the Work Practices of Crowdfarms,,595.mp4,595.srt,https://www.youtube.com/watch?v=B46Q8ez5b1o,N
596,596.0,,,,,,Let’s Share a Ride into the Future: A Qualitative Study Comparing Potential Implementation ...,,596.mp4,596.srt,https://www.youtube.com/watch?v=-XdLGAXTFLg,N
597,597.0,,,,,,MirrorBlender: Supporting Hybrid Meetings with a Malleable Video-Conferencing System,,597.mp4,597.srt,https://www.youtube.com/watch?v=9a7fY29qQ2I,N
598,598.0,,,,,,Ask Me or Tell Me? Enhancing the Effectiveness of Crowdsourced Design Feedback,,598.mp4,598.srt,https://www.youtube.com/watch?v=qtZ1bYAfi1I,N
599,599.0,,,,,,TiltChair: Manipulative Posture Guidance by Actively Inclining the Seat of an Office Chair,,599.mp4,599.srt,https://www.youtube.com/watch?v=EuBmw3hVEuM,N
600,600.0,,,,,,A Simulation Model of Intermittently Controlled Point-and-Click Behaviour,,600.mp4,600.srt,https://www.youtube.com/watch?v=-qJ76VXEqV4,N
601,601.0,,,,,,Designing Civic Technology with Trust,,601.mp4,601.srt,https://www.youtube.com/watch?v=4stLpKE9HpA,N
602,602.0,,,,,,Phonetroller: Visual Representations of Fingers for Precise Touch Input when using a Phone in VR,,602.mp4,602.srt,https://www.youtube.com/watch?v=9K-tKPQocjM,N
603,603.0,,,,,,Collecting and Characterizing Natural Language Utterances for Specifying Data Visualizations,,603.mp4,603.srt,https://www.youtube.com/watch?v=CYRVJFBLmH0,N
604,604.0,,,,,,Designing Metamaterial Cells to Enrich Thermoforming 3D Printed Objects for Post-Print Modification,,604.mp4,604.srt,https://www.youtube.com/watch?v=z63voBGzX0g,N
605,605.0,,,,,,Cracking Public Space Open: Design for Public Librarians,,605.mp4,605.srt,https://www.youtube.com/watch?v=pAu0wue9Cvo,N
606,606.0,,,,,,Heterogeneous Stroke: Using Unique Vibration Cues to Improve the Wrist-Worn Spatiotemporal ...,,606.mp4,606.srt,https://www.youtube.com/watch?v=nIAWfPI1eKs,N
607,607.0,,,,,,“They don’t always think about that”: Translational Needs in the Design of Personal Health ...,,607.mp4,607.srt,https://www.youtube.com/watch?v=L255Qb8aqbA,N
608,608.0,,,,,,"""Beyond 3D printers"": Understanding Digital Fabrication Practices for the Education of Visually ...",,608.mp4,608.srt,https://www.youtube.com/watch?v=zn34slNcxp8,N
609,609.0,,,,,,Building for ‘We’: Safety Settings for Couples with Memory Concerns,,609.mp4,609.srt,https://www.youtube.com/watch?v=zzYY4uYJmAQ,N
610,610.0,,,,,,The Show Must Go On: A conceptual model of conducting synchronous participatory design with ...,,610.mp4,610.srt,https://www.youtube.com/watch?v=QxLaiHbfvX4,N
611,611.0,,,,,,Learning to Automate Chart Layout Configurations Using Crowdsourced Paired Comparison,,611.mp4,611.srt,https://www.youtube.com/watch?v=MqW_5b_R-jw,N
612,612.0,,,,,,Think-Aloud Computing: Supporting Rich and Low-Effort Knowledge Capture,,612.mp4,612.srt,https://www.youtube.com/watch?v=SOtTRsHMxD8,N
613,613.0,,,,,,Unpacking “Boardgames With Apps”: The Hybrid Digital Boardgame Model,,613.mp4,613.srt,https://www.youtube.com/watch?v=Kda5oe9nVaQ,N
614,614.0,,,,,,A Visual Analytics Approach to Facilitate the Proctoring of Online Exams,,614.mp4,614.srt,https://www.youtube.com/watch?v=cVhG9KamMBc,N
615,615.0,,,,,,TUI as Social Entity: a Study of Joint-actuation and Turn-taking-actuation in Actuated-interfaces,,615.mp4,615.srt,https://www.youtube.com/watch?v=DKVUEJhGOKE,N
616,616.0,,,,,,Improving Instruction of Programming Patterns with Faded Parsons Problems,,616.mp4,616.srt,https://www.youtube.com/watch?v=vnmrt2UTWNE,N
617,617.0,,,,,,Prepare for Trouble and Make It Double: The Power Motive Predicts Pokémon Choices Based on ...,,617.mp4,617.srt,https://www.youtube.com/watch?v=A5zJ0U8YtQc,N
618,618.0,,,,,,Dance and Choreography in HCI: A Two-Decade Retrospective,,618.mp4,618.srt,https://www.youtube.com/watch?v=p030qXf3Wlg,N
619,619.0,,,,,,"Assessing MyData Scenarios: Ethics, Concerns, and the Promise",,619.mp4,619.srt,https://www.youtube.com/watch?v=N-v4c18o0js,N
620,620.0,,,,,,Comparison of Different Types of Augmented Reality Visualizations for Instructions,,620.mp4,620.srt,https://www.youtube.com/watch?v=LbKdIVSbCsU,N
621,621.0,,,,,,Designing Conversational Agents: A Self-Determination Theory Approach,,621.mp4,621.srt,https://www.youtube.com/watch?v=aXReZLQX65w,N
622,622.0,,,,,,Human-AI Interaction in Human Resource Management: Understanding Why Employees Resist ...,,622.mp4,622.srt,https://www.youtube.com/watch?v=4Ib3wAuv7AE,N
623,623.0,,,,,,Tessera: Discretizing Data Analysis Workflows on a Task Level,,623.mp4,623.srt,https://www.youtube.com/watch?v=p6o0mw-LdJ8,N
624,624.0,,,,,,"Understanding Everyday Experiences of Reminiscence for People with Blindness: Practices, ...",,624.mp4,624.srt,https://www.youtube.com/watch?v=NTTUDvub6DE,N
625,625.0,,,,,,``You Gotta Watch What You Say'': Surveillance of Communication with Incarcerated People,,625.mp4,625.srt,https://www.youtube.com/watch?v=7lkXtAwQa-Y,N
626,626.0,,,,,,The Lived Experience of Child-Owned Wearables: Comparing Children’s and Parents’ Perspectives on ...,,626.mp4,626.srt,https://www.youtube.com/watch?v=3yb8roAteY0,N
627,627.0,,,,,,Vinci: An Intelligent Graphic Design System for Generating Advertising Posters,,627.mp4,627.srt,https://www.youtube.com/watch?v=KqAHMFHaX-I,N
628,628.0,,,,,,MorpheesPlug: A Toolkit for Prototyping Shape-Changing Interfaces,,628.mp4,628.srt,https://www.youtube.com/watch?v=xrvTtvvi4oE,N
629,629.0,,,,,,Exploring the Opportunities for Online Learning Platforms to Support the Emergency Home School ...,,629.mp4,629.srt,https://www.youtube.com/watch?v=arxnTJmMy4I,N
630,630.0,,,,,,Exploring A Reporting Tool to Empower Individuals with Intellectual and Developmental ...,,630.mp4,630.srt,https://www.youtube.com/watch?v=uv_XO_d0aBI,N
631,631.0,,,,,,Armed in ARMY: A Case Study of How BTS Fans Successfully Collaborated to #MatchAMillion for ...,,631.mp4,631.srt,https://www.youtube.com/watch?v=CnblQJphh8U,N
632,632.0,,,,,,Poros: Configurable Proxies for Distant Interactions in VR,,632.mp4,632.srt,https://www.youtube.com/watch?v=IjriqHShSdI,N
633,633.0,,,,,,When the Tab Comes Due: Challenges in the Cost Structure of Tab Usage,,633.mp4,633.srt,https://www.youtube.com/watch?v=pBjIrX9H-Ns,N
634,634.0,,,,,,Exploring Generative Models with Middle School Students,,634.mp4,634.srt,https://www.youtube.com/watch?v=ZXcoFSIOEDk,N
635,635.0,,,,,,From Reflection to Action: Combining Machine Learning with Expert Knowledge for Nutrition Goal ...,,635.mp4,635.srt,https://www.youtube.com/watch?v=UccHoOkQ3s0,N
636,636.0,,,,,,Snowflakes: A Prototyping Tool for Computational Jewelry,,636.mp4,636.srt,https://www.youtube.com/watch?v=N6czMplZ8qk,N
637,637.0,,,,,,Exploring a Makeup Support System for Transgender Passing based on Automatic Gender Recognition,,637.mp4,637.srt,https://www.youtube.com/watch?v=4iDxz52rHoc,N
638,638.0,,,,,,More Kawaii than a Real-Person Streamer: Understanding How the Otaku Community Engages with and ...,,638.mp4,638.srt,https://www.youtube.com/watch?v=IuMhbo0MZrU,N
639,639.0,,,,,,What Makes Videos Accessible to Blind and Visually Impaired People?,,639.mp4,639.srt,https://www.youtube.com/watch?v=n2enrJJZdTs,N
640,640.0,,,,,,PatchProv: Supporting Improvisational Design Practices for Modern Quilting,,640.mp4,640.srt,https://www.youtube.com/watch?v=7lmEzwywq1U,N
641,641.0,,,,,,Transgender People's Technology Needs to Support Health and Transition,,641.mp4,641.srt,https://www.youtube.com/watch?v=qK_nXNi2Usg,N
642,642.0,,,,,,RubySlippers: Supporting Content-based Voice Navigation for How-to Videos,,642.mp4,642.srt,https://www.youtube.com/watch?v=WxCB0GGVCDA,N
643,643.0,,,,,,The Complexity of Indoor Air Quality Forecasting and the Simplicity of Interacting with It – A ...,,643.mp4,643.srt,https://www.youtube.com/watch?v=JYG8sMDYxAE,N
644,644.0,,,,,,ChromoUpdate: Locally Updating Photochromic Multi-Color Textures for Fast Design Iterations,,644.mp4,644.srt,https://www.youtube.com/watch?v=_IhbcPGwywI,N
645,645.0,,,,,,Are You Open? A Content Analysis of Transparency and Openness Guidelines in HCI Journals,,645.mp4,645.srt,https://www.youtube.com/watch?v=1ABQZ6XQjys,N
646,646.0,,,,,,LaserFactory: An Electromechanical Assembly and Fabrication Platform Integrated with a Laser ...,,646.mp4,646.srt,https://www.youtube.com/watch?v=8s0d-fcc5gI,N
647,647.0,,,,,,A Computational Approach to Magnetic Force Feedback Design,,647.mp4,647.srt,https://www.youtube.com/watch?v=he1jwF_DW0Q,N
648,648.0,,,,,,Resisting the Medicalisation of Menopause: Reclaiming the Body through Design,,648.mp4,648.srt,https://www.youtube.com/watch?v=Qr9K9ScP6BI,N
649,649.0,,,,,,Context-Based Interface Prototyping: Understanding the Effect of Prototype Representation on ...,,649.mp4,649.srt,https://www.youtube.com/watch?v=ydEIqy9DzVs,N
650,650.0,,,,,,Squish This: Force Input on Soft Surfaces for Visual Targeting Tasks,,650.mp4,650.srt,https://www.youtube.com/watch?v=evx8VMTwFz0,N
651,651.0,,,,,,"""Whatever the Emotional Experience, It's Up to Them"": Insights from Designers of Emotionally ...",,651.mp4,651.srt,https://www.youtube.com/watch?v=V17YC4EDbm0,N
652,652.0,,,,,,Tailoring Persuasive and Behaviour Change Systems Based on Stages of Change and Motivation,,652.mp4,652.srt,https://www.youtube.com/watch?v=CKWsUOrFvn4,N
653,653.0,,,,,,Neuromancer Workshop: Towards Designing Experiential Entanglement with Science Fiction,,653.mp4,653.srt,https://www.youtube.com/watch?v=n2lL6HVt2xo,N
654,654.0,,,,,,Covert Embodied Choice: Decision-Making and the Limits of Privacy Under Biometric Surveillance,,654.mp4,654.srt,https://www.youtube.com/watch?v=bbHZmUV5Tlc,N
655,655.0,,,,,,"Meeting You, Seeing Me: The Role of Social Anxiety, Visual Feedback, and Interface Layout in a ...",,655.mp4,655.srt,https://www.youtube.com/watch?v=JTpUhjKf8Wg,N
656,656.0,,,,,,Heuristic Evaluation of Conversational Agents,,656.mp4,656.srt,https://www.youtube.com/watch?v=CMHsYnhs6Xk,N
657,657.0,,,,,,ArticuLev: An Integrated Self-Assembly Pipeline for Articulated Multi-Bead Levitation Primitives,,657.mp4,657.srt,https://www.youtube.com/watch?v=EgKfkCqBb48,N
658,658.0,,,,,,Itsy-Bits: Fabrication and Recognition of 3D-Printed Tangibles with Small Footprints on ...,,658.mp4,658.srt,https://www.youtube.com/watch?v=fI3zZz4fnMY,N
659,659.0,,,,,,PTeacher: a Computer-Aided Personalized Pronunciation Training System with Exaggerated ...,,659.mp4,659.srt,https://www.youtube.com/watch?v=AeDKn5DwVfI,N
660,660.0,,,,,,The Ethics of Multiplayer Game Design and Community Management: Industry Perspectives and Challenges,,660.mp4,660.srt,https://www.youtube.com/watch?v=V0EOGqVzqA8,N
661,661.0,,,,,,LGBTQ Persons' Pregnancy Loss Disclosures to Known Ties on Social Media: Disclosure Decisions ...,,661.mp4,661.srt,https://www.youtube.com/watch?v=t-gSpCF3BRQ,N
662,662.0,,,,,,FaceSight: Enabling Hand-to-Face Gesture Interaction on AR Glasses with a Downward-Facing Camera ...,,662.mp4,662.srt,https://www.youtube.com/watch?v=-7SguLmalco,N
663,663.0,,,,,,Assisting Manipulation and Grasping in Robot Teleoperation with Augmented Reality Visual Cues,,663.mp4,663.srt,https://www.youtube.com/watch?v=DTl9tcXJ_NA,N
664,664.0,,,,,,Taking Mental Health & Well-Being to the Streets: An Exploratory Evaluation of In-Vehicle ...,,664.mp4,664.srt,https://www.youtube.com/watch?v=zP0_0Zt-or0,N
665,665.0,,,,,,SoniBand: Understanding the Effects of Metaphorical Movement Sonifications on Body Perception ...,,665.mp4,665.srt,https://www.youtube.com/watch?v=qpgqgITAPbA,N
666,666.0,,,,,,EventAnchor: Reducing Human Interactions in Event Annotation of Racket Sports Videos,,666.mp4,666.srt,https://www.youtube.com/watch?v=TPpzko4TDWQ,N
667,667.0,,,,,,Enacting the Last Mile: Experiences of Smart Contracts in Courier Deliveries,,667.mp4,667.srt,https://www.youtube.com/watch?v=CHlrXLQD110,N
668,668.0,,,,,,Vis Ex Machina: An Analysis of Trust in Human versus Algorithmically Generated Visualization ...,,668.mp4,668.srt,https://www.youtube.com/watch?v=5ZRl2hYv6VU,N
669,669.0,,,,,,What Matters in Professional Drone Pilots’ Practice? An Interview Study to Understand the ...,,669.mp4,669.srt,https://www.youtube.com/watch?v=K4opNyuC_9M,N
670,670.0,,,,,,The Disagreement Deconvolution: Bringing Machine Learning Performance Metrics In Line With Reality,,670.mp4,670.srt,https://www.youtube.com/watch?v=vDCLq_JugSI,N
671,671.0,,,,,,XRgonomics: Facilitating the Creation of Ergonomic 3D Interfaces,,671.mp4,671.srt,https://www.youtube.com/watch?v=C36hpE1c1uE,N
672,672.0,,,,,,Exploring Approaches to Data Literacy Through a Critical Race Theory Perspective,,672.mp4,672.srt,https://www.youtube.com/watch?v=QXYTF2przfU,N
673,673.0,,,,,,Privacy Norms for Smart Home Personal Assistants,,673.mp4,673.srt,https://www.youtube.com/watch?v=2dOgCh6jvOs,N
674,674.0,,,,,,Human-Nature Relations in Urban Gardens: Explorations with Camera Traps,,674.mp4,674.srt,https://www.youtube.com/watch?v=-ggS_0fCAJ8,N
675,675.0,,,,,,Do You Really Need to Know Where 'That' Is? Enhancing Support for Referencing in Collaborative ...,,675.mp4,675.srt,https://www.youtube.com/watch?v=DSPsRXnCnkY,N
676,676.0,,,,,,Identifying Manipulative Advertising Techniques in XR Through Scenario Construction,,676.mp4,676.srt,https://www.youtube.com/watch?v=RqFTR9J7xQw,N
677,677.0,,,,,,Locomotion Vault: the Extra Mile in Analyzing VR Locomotion Techniques,,677.mp4,677.srt,https://www.youtube.com/watch?v=83UAsKMx7Zg,N
678,678.0,,,,,,Revamp: Enhancing Accessible Information Seeking Experience of Online Shopping for Blind or Low ...,,678.mp4,678.srt,https://www.youtube.com/watch?v=WZaw9ziqrNU,N
679,679.0,,,,,,It’s Not Just the Movement: Experiential Information Needed for Stroke Telerehabilitation,,679.mp4,679.srt,https://www.youtube.com/watch?v=YQRJIXAjj3c,N
680,680.0,,,,,,Method for Exploring Generative Adversarial Networks (GANs) via Automatically Generated Image ...,,680.mp4,680.srt,https://www.youtube.com/watch?v=PvXMX7RIylI,N
681,681.0,,,,,,Data@Hand: Fostering Visual Exploration of Personal Data on Smartphones Leveraging Speech and ...,,681.mp4,681.srt,https://www.youtube.com/watch?v=KAjCiMAKf4I,N
682,682.0,,,,,,“Feeling the sensor feeling you”: A soma design exploration on sensing non-habitual breathing,,682.mp4,682.srt,https://www.youtube.com/watch?v=bY82dGWywj8,N
683,683.0,,,,,,NBSearch: Semantic Search and Visual Exploration of Computational Notebooks,,683.mp4,683.srt,https://www.youtube.com/watch?v=jnJVZiL8TDA,N
684,684.0,,,,,,The Gang’s All Here: How People Used Games to cope with COVID19 Quarantine,,684.mp4,684.srt,https://www.youtube.com/watch?v=st0cySL4w5E,N
685,685.0,,,,,,MARVIS: Combining Mobile Devices and Augmented Reality for Visual Data Analysis,,685.mp4,685.srt,https://www.youtube.com/watch?v=uTDfiGbQU78,N
686,686.0,,,,,,On Smartphone Users' Difficulty with Understanding Implicit Authentication,,686.mp4,686.srt,https://www.youtube.com/watch?v=2mVgJKe2zAA,N
687,687.0,,,,,,Exploring Text Revision with Backspace and Caret in Virtual Reality,,687.mp4,687.srt,https://www.youtube.com/watch?v=Inpyiy7TNd4,N
688,688.0,,,,,,Design in Action: Unpacking the Artists' Role in Performance-Led Research,,688.mp4,688.srt,https://www.youtube.com/watch?v=supVFSSxzp0,N
689,689.0,,,,,,Clandestino or Rifugiato? Anti-immigration Facebook Ad Targeting in Italy,,689.mp4,689.srt,https://www.youtube.com/watch?v=KIPYWs_xhDY,N
690,690.0,,,,,,Older Adults' Think-Aloud Verbalizations and Speech Features for Identifying User Experience ...,,690.mp4,690.srt,https://www.youtube.com/watch?v=Auo2Lk77IBE,N
691,691.0,,,,,,Designing Menstrual Technologies with Adolescents,,691.mp4,691.srt,https://www.youtube.com/watch?v=6smyCA51U_g,N
692,692.0,,,,,,Adaptive Subtitles: Preferences and Trade-Offs in Real-Time Media Adaption,,692.mp4,692.srt,https://www.youtube.com/watch?v=KVdB-1amzd4,N
693,693.0,,,,,,Designing Interactive Transfer Learning Tools for ML Non-Experts,,693.mp4,693.srt,https://www.youtube.com/watch?v=bYG9EATbnsw,N
694,694.0,,,,,,Exploring Awareness of Breathing through Deep Touch Pressure,,694.mp4,694.srt,https://www.youtube.com/watch?v=b_1t7TjxnCk,N
695,695.0,,,,,,Religion and Women's Intimate Health: Towards an Inclusive Approach to Healthcare,,695.mp4,695.srt,https://www.youtube.com/watch?v=MJFKgRCqFas,N
696,696.0,,,,,,Journalistic Source Discovery: Supporting The Identification of News Sources in User Generated ...,,696.mp4,696.srt,https://www.youtube.com/watch?v=KAlvX8P2clg,N
697,697.0,,,,,,Data-Driven Mark Orientation for Trend Estimation in Scatterplots,,697.mp4,697.srt,https://www.youtube.com/watch?v=SJB5-a6jMJs,N
698,698.0,,,,,,Technology Developments in Touch-Based Accessible Graphics: A Systematic Review of Research ...,,698.mp4,698.srt,https://www.youtube.com/watch?v=OJCY1Diokjc,N
699,699.0,,,,,,ADIO: An Interactive Artifact Physically Representing the Intangible Digital Audiobook Listening ...,,699.mp4,699.srt,https://www.youtube.com/watch?v=-Z7-yIoIL_4,N
700,700.0,,,,,,EvalMe: Exploring the Value of New Technologies for In Situ Evaluation of Learning Experiences,,700.mp4,700.srt,https://www.youtube.com/watch?v=w_4pFMGeb5U,N
701,701.0,,,,,,Automatic Generation of Two Level Hierarchical Tutorials from Instructional Makeup Videos,,701.mp4,701.srt,https://www.youtube.com/watch?v=HFZkph6G70A,N
702,702.0,,,,,,Exquisite Fabrication: Exploring Turn-Taking Between Designers and Digital Fabrication Machines,,702.mp4,702.srt,https://www.youtube.com/watch?v=rW7ahr9IOG4,N
703,703.0,,,,,,Diagramming Working Field Theories for Design in the HCI Classroom,,703.mp4,703.srt,https://www.youtube.com/watch?v=KcFK3REPIaQ,N
704,704.0,,,,,,Disagree? You Must Be a Bot! How Beliefs Shape Twitter Profile Perceptions,,704.mp4,704.srt,https://www.youtube.com/watch?v=Kv0Zy4c2Ru0,N
705,705.0,,,,,,HandPainter --- 3D Sketching in VR with Hand-based Physical Proxy,,705.mp4,705.srt,https://www.youtube.com/watch?v=V8NH_6xLoQ4,N
706,706.0,,,,,,LightWrite: Teach Handwriting to The Visually Impaired with A Smartphone,,706.mp4,706.srt,https://www.youtube.com/watch?v=W2DD0zaK_x4,N
707,707.0,,,,,,Determining the Effect of Smartphone Alerts and Warnings on Street-Crossing Behavior in ...,,707.mp4,707.srt,https://www.youtube.com/watch?v=-0dMghdM7FE,N
708,708.0,,,,,,MeetingCoach: An Intelligent Dashboard for Supporting Effective & Inclusive Meetings,,708.mp4,708.srt,https://www.youtube.com/watch?v=HtOmN_q2Xlk,N
709,709.0,,,,,,IdeaBot: Investigating Social Facilitation in Human-Machine Team Creativity,,709.mp4,709.srt,https://www.youtube.com/watch?v=XFhPYg2g11k,N
710,710.0,,,,,,Expanding Explainability: Towards Social Transparency in AI systems,,710.mp4,710.srt,https://www.youtube.com/watch?v=OkxvNoZyoDw,N
711,711.0,,,,,,Teachers' Perceptions around  Digital Games for Children in Low-resource Schools for the Blind,,711.mp4,711.srt,https://www.youtube.com/watch?v=fc7ok0m9trQ,N
712,712.0,,,,,,Opening research commissioning to civic participation: creating a community panel to review the ...,,712.mp4,712.srt,https://www.youtube.com/watch?v=p4wOBiwuAyQ,N
713,713.0,,,,,,"It cannot do all of my work"": Community Health Worker Perceptions of AI-Enabled Mobile Health ...",,713.mp4,713.srt,https://www.youtube.com/watch?v=4z4FmLnT3OA,N
714,714.0,,,,,,A Taxonomy of Vulnerable Road Users for HCI Based On A Systematic Literature Review,,714.mp4,714.srt,https://www.youtube.com/watch?v=gzxKI_oeVRM,N
715,715.0,,,,,,"Tools, Tricks, and Hacks: Exploring Novel Digital Fabrication Workflows on #PlotterTwitter",,715.mp4,715.srt,https://www.youtube.com/watch?v=xqhT-8ElJ68,N
716,,,,,,,Elevate: A Walkable Pin-Array for Large Shape-Changing Terrains,,716.mp4,716.srt,https://www.youtube.com/watch?v=G4n-WHrbPiU,N
717,,,,,,,Picturing It!: The Effect of Image Styles on User Perceptions of Personas,,717.mp4,717.srt,https://www.youtube.com/watch?v=GOYkRtO7OUY,N
718,,,,,,,"StickyPie: A Gaze-Based, Scale-Invariant Marking Menu Optimized for AR/VR",,718.mp4,718.srt,https://www.youtube.com/watch?v=y19LAWdFkU4,N
719,,,,,,,What Makes Civic Tech Initiatives To Last Over Time? Dissecting Two Global Cases,,719.mp4,719.srt,https://www.youtube.com/watch?v=GS5l6gAyXwc,N
720,,,,,,,"""I Can't Reply with That"": Characterizing Problematic Email Reply Suggestions",,720.mp4,720.srt,https://www.youtube.com/watch?v=PVsFVh6j7ao,N
721,,,,,,,Engaging with Nature Sounds & Citizen Science by Designing for Creative & Contextual Audio ...,,721.mp4,721.srt,https://www.youtube.com/watch?v=MM2OktI--Oc,N
722,,,,,,,Communication Skills Training Intervention Based on Automated Recognition of Nonverbal Signals,,722.mp4,722.srt,https://www.youtube.com/watch?v=dhe6U6d8FZU,N
723,,,,,,,STREAM: Exploring the Combination of Spatially-Aware Tablets with Augmented Reality Head-Mounted ...,,723.mp4,723.srt,https://www.youtube.com/watch?v=bl9KntXJm9I,N
724,,,,,,,TapeBlocks: A Making Toolkit for People Living with Intellectual Disabilities,,724.mp4,724.srt,https://www.youtube.com/watch?v=cNrf8aFK8Qg,N
725,,,,,,,A Critique of Electrodermal Activity Practices at CHI,,725.mp4,725.srt,https://www.youtube.com/watch?v=DMGaNdKt1FE,N
726,,,,,,,Towards More Transactional Voice Assistants: Investigating the Potential for a Multimodal ...,,726.mp4,726.srt,https://www.youtube.com/watch?v=Iu9114nrcHw,N
727,,,,,,,“I Am Iron Man” Priming Improves the Learnability and Memorability of User-Elicited Gestures,,727.mp4,727.srt,https://www.youtube.com/watch?v=ngi-7xXotUk,N
728,,,,,,,Whither AutoML? Understanding the Role of Automation in Machine Learning Workflows,,728.mp4,728.srt,https://www.youtube.com/watch?v=mmptWeCS4Bk,N
729,,,,,,,A Feminist Utopian Perspective on the Practice and Promise of Making,,729.mp4,729.srt,https://www.youtube.com/watch?v=9dFl_yIuMBw,N
730,,,,,,,MetaMap: Supporting Visual Metaphor Ideation through Multi-dimensional Example-based Exploration,,730.mp4,730.srt,https://www.youtube.com/watch?v=Fq6wEQNpWjA,N
731,,,,,,,What Do Hackathons Do? Understanding Participation in Hackathons Through Program Theory Analysis,,731.mp4,731.srt,https://www.youtube.com/watch?v=7He-GOIP-Rk,N
