,Unnamed: 0,Unnamed: 0.1,Unnamed: 0.1.1,Unnamed: 0.1.1.1,Unnamed: 0.1.1.1.1,Unnamed: 0.1.1.1.1.1,title,paper_file,video_file,subtitle_file,video_url,data_imported
283,283.0,283.0,283.0,283.0,283.0,283.0,"HapticSeer: A Multi-channel, Black-box, Platform-agnostic Approach to Detecting Video Game ...",,283.mp4,283.srt,https://www.youtube.com/watch?v=euGM0zv80AI,N
284,284.0,284.0,284.0,284.0,284.0,284.0,Voicemoji: Emoji Entry Using Voice for Visually Impaired People,,284.mp4,284.srt,https://www.youtube.com/watch?v=4C9UPHmtHmk,N
285,285.0,285.0,285.0,285.0,285.0,285.0,How to Evaluate Object Selection and Manipulation in VR? Guidelines from 20 Years of Studies,,285.mp4,285.srt,https://www.youtube.com/watch?v=0m6slo_Ne6U,N
286,286.0,286.0,286.0,286.0,286.0,286.0,An Activity Theory Analysis of Search & Rescue Collective Sensemaking and Planning Practices,,286.mp4,286.srt,https://www.youtube.com/watch?v=9-872QKXeCE,N
287,287.0,287.0,287.0,287.0,287.0,287.0,"Can Online Juries Make Consistent, Repeatable Decisions?",,287.mp4,287.srt,https://www.youtube.com/watch?v=lnrZrd4G68Q,N
288,288.0,288.0,288.0,288.0,288.0,288.0,Breakdowns and Breakthroughs: Observing Musicians' Responses to the COVID-19 Pandemic,,288.mp4,288.srt,https://www.youtube.com/watch?v=0oci3_IEQns,N
289,289.0,289.0,289.0,289.0,289.0,289.0,FashionQ: An AI-Driven Creativity Support Tool for Facilitating Ideation in Fashion Design,,289.mp4,289.srt,https://www.youtube.com/watch?v=MZHfGiVachY,N
290,290.0,290.0,290.0,290.0,290.0,290.0,"“Put it on the Top, I’ll Read it Later”: Investigating Users’ Desired Display Order for ...",,290.mp4,290.srt,https://www.youtube.com/watch?v=vQcymenGpeU,N
291,291.0,291.0,291.0,291.0,291.0,291.0,Understanding the Design Space of Embodied Passwords based on Muscle Memory,,291.mp4,291.srt,https://www.youtube.com/watch?v=fN8dGp5Esyw,N
292,292.0,292.0,292.0,292.0,292.0,292.0,CakeVR: A Social Virtual Reality (VR) Tool for Co-designing Cakes,,292.mp4,292.srt,https://www.youtube.com/watch?v=2ss8AQq_gCs,N
293,293.0,293.0,293.0,293.0,293.0,293.0,Soliciting Stakeholders’ Fairness Notions in Child Maltreatment Predictive Systems,,293.mp4,293.srt,https://www.youtube.com/watch?v=Sx8ngo9nMcc,N
294,294.0,294.0,294.0,294.0,294.0,294.0,Mapping Design Spaces for Teaching Audience Participation in Game Live Streaming,,294.mp4,294.srt,https://www.youtube.com/watch?v=SrDvauNUE6c,N
295,295.0,295.0,295.0,295.0,295.0,295.0,NFCSense: Data-Defined Rich-ID Motion Sensing for Fluent Tangible Interaction Using a Commodity ...,,295.mp4,295.srt,https://www.youtube.com/watch?v=hVIdLtIIaqs,N
296,296.0,296.0,296.0,296.0,296.0,296.0,Vibrosight++: City-Scale Sensing Using Existing Retroreflective Signs and Markers,,296.mp4,296.srt,https://www.youtube.com/watch?v=qr4le1cOhGs,N
297,297.0,297.0,297.0,297.0,297.0,297.0,Detecting Data Falsification by Front-line Development Workers: A Case Study of Vaccination in ...,,297.mp4,297.srt,https://www.youtube.com/watch?v=IuMgTgZpDqc,N
298,298.0,298.0,298.0,298.0,298.0,298.0,ReverseORC: Reverse Engineering of Resizable User Interface Layouts with OR-Constraints,,298.mp4,298.srt,https://www.youtube.com/watch?v=FL0ck3_C22k,N
299,299.0,299.0,299.0,299.0,299.0,299.0,EscapeLoom: Fabricating New Affordances for Hand Weaving,,299.mp4,299.srt,https://www.youtube.com/watch?v=LulqS43v4xA,N
300,300.0,300.0,300.0,300.0,300.0,300.0,Data Prophecy: Exploring the Effects of Belief Elicitation in Visual Analytics,,300.mp4,300.srt,https://www.youtube.com/watch?v=qMOMBt_6nfw,N
301,301.0,301.0,301.0,301.0,301.0,301.0,Proceed with Care: Reimagining Home IoT Through a Care Perspective,,301.mp4,301.srt,https://www.youtube.com/watch?v=tDlg40zp3sc,N
302,302.0,302.0,302.0,302.0,302.0,302.0,"""I Choose Assistive Devices That Save My Face"" A Study on Perceptions of Accessibility and ...",,302.mp4,302.srt,https://www.youtube.com/watch?v=k-TwkwHASCs,N
303,303.0,303.0,303.0,303.0,303.0,303.0,Preserving Agency During Electrical Muscle Stimulation Training Speeds up Reaction Time Directly ...,,303.mp4,303.srt,https://www.youtube.com/watch?v=_54TMZchuwg,N
304,304.0,304.0,304.0,304.0,304.0,304.0,Beyond Kant and Bentham: How Ethical Theories are being used in Artificial Moral Agents,,304.mp4,304.srt,https://www.youtube.com/watch?v=_M14LJYDVqU,N
305,305.0,305.0,305.0,305.0,305.0,305.0,Examining the Use Online Platforms for Employment: A Survey of U.S. Job Seekers,,305.mp4,305.srt,https://www.youtube.com/watch?v=iN2iYlSVOv8,N
306,306.0,306.0,306.0,306.0,306.0,306.0,Data as Delight: Eating data,,306.mp4,306.srt,https://www.youtube.com/watch?v=cPxBd_AvSyQ,N
307,307.0,307.0,307.0,307.0,307.0,307.0,The Ecological Context of Preschool-Aged Children’s Selection of Media Content,,307.mp4,307.srt,https://www.youtube.com/watch?v=aqz0PcBDUKY,N
308,308.0,308.0,308.0,308.0,308.0,308.0,Understanding Blind Screen-Reader Users' Experiences of Digital Artboards,,308.mp4,308.srt,https://www.youtube.com/watch?v=pHF-UU_f6_0,N
309,309.0,309.0,309.0,309.0,309.0,309.0,Biographies of Biometric Devices: The POS Machine at Work in India’s PDS,,309.mp4,309.srt,https://www.youtube.com/watch?v=5VAHyw8Bg8U,N
310,310.0,310.0,310.0,310.0,310.0,310.0,"Current Practices, Challenges, and Design Implications for Collaborative AR/VR Application ...",,310.mp4,310.srt,https://www.youtube.com/watch?v=cX1XsGhrNJw,N
311,311.0,311.0,311.0,311.0,311.0,311.0,Datamations: Animated Explanations of Data Analysis Pipelines,,311.mp4,311.srt,https://www.youtube.com/watch?v=d0mn9iGDKbo,N
312,312.0,312.0,312.0,312.0,312.0,312.0,Physiological and Perceptual Responses to Athletic Avatars while Cycling in Virtual Reality,,312.mp4,312.srt,https://www.youtube.com/watch?v=4OciAqRXH6U,N
313,313.0,313.0,313.0,313.0,313.0,313.0,"A Chinese-Language Validation of the Video Game Demand Scale (VGDS-C): Measuring the Cognitive, ...",,313.mp4,313.srt,https://www.youtube.com/watch?v=PHC64jhFWBw,N
314,314.0,314.0,314.0,314.0,314.0,314.0,The Design Space of Wearables for Sports and Fitness Practices,,314.mp4,314.srt,https://www.youtube.com/watch?v=_bfLT6-krwY,N
315,315.0,315.0,315.0,315.0,315.0,315.0,Synthesis of Forms: Integrating Practical and Reflective Qualities in Design,,315.mp4,315.srt,https://www.youtube.com/watch?v=WjRZmXaTbOY,N
316,316.0,316.0,316.0,316.0,316.0,316.0,"Augmenting Scientific Papers with Just-in-Time, Position-Sensitive Definitions of Terms and Symbols",,316.mp4,316.srt,https://www.youtube.com/watch?v=GXwc6YVg22I,N
317,317.0,317.0,317.0,317.0,317.0,,Effects of Emotion and Agency on Presence in Virtual Reality,,317.mp4,317.srt,https://www.youtube.com/watch?v=cmi1cKXul2k,N
318,318.0,318.0,318.0,318.0,318.0,,Apps Against the Spread: Privacy Implications and User Acceptance of COVID-19-Related Smartphone ...,,318.mp4,318.srt,https://www.youtube.com/watch?v=X9MQKE5N7hc,N
319,319.0,319.0,319.0,319.0,319.0,,"Head-Worn Displays for Emergency Medical Services Staff: Properties of Prehospital Work, Use ...",,319.mp4,319.srt,https://www.youtube.com/watch?v=oRaXu08GbRs,N
320,320.0,320.0,320.0,320.0,320.0,,"In Tension with Progression: Grasping the Frictional Tendencies of Speculative, Critical, and ...",,320.mp4,320.srt,https://www.youtube.com/watch?v=3Uc6bMyxKyI,N
321,321.0,321.0,321.0,321.0,321.0,,Patterns for Representing Knowledge Graphs to Communicate Situational Knowledge of Service Robots,,321.mp4,321.srt,https://www.youtube.com/watch?v=0iErmMi7Q5M,N
322,322.0,322.0,322.0,322.0,322.0,,MomentMeld: AI-augmented Mobile Photographic Memento towards Mutually Stimulatory ...,,322.mp4,322.srt,https://www.youtube.com/watch?v=3X-c5yU3X0I,N
323,323.0,323.0,323.0,323.0,323.0,,"Designing Telepresence Drones to Support Synchronous, Mid-air, Remote Collaboration: An ...",,323.mp4,323.srt,https://www.youtube.com/watch?v=hfRLq3JaeBI,N
324,324.0,324.0,324.0,324.0,324.0,,Thermoformed Circuit Boards: Fabrication of highly conductive freeform 3D printed circuit boards ...,,324.mp4,324.srt,https://www.youtube.com/watch?v=5plL26h7txc,N
325,325.0,325.0,325.0,325.0,325.0,,Evaluating the Interpretability of Generative Models by Interactive Reconstruction,,325.mp4,325.srt,https://www.youtube.com/watch?v=zbPeMT-ssXo,N
326,326.0,326.0,326.0,326.0,326.0,,``Constant Pressure of Having to Perform'': Exploring Player Health Concerns in Esports,,326.mp4,326.srt,https://www.youtube.com/watch?v=R9WvUCiYlwM,N
327,327.0,327.0,327.0,327.0,327.0,,The Role of Working Memory in Program Tracing,,327.mp4,327.srt,https://www.youtube.com/watch?v=-C1gQg07Jis,N
328,328.0,328.0,328.0,328.0,328.0,,MIRIA: A Mixed Reality Toolkit for the In-Situ Visualization and Analysis of Spatio-Temporal ...,,328.mp4,328.srt,https://www.youtube.com/watch?v=0Gf0kpOWtLs,N
329,329.0,329.0,329.0,329.0,329.0,,Comparing Perspectives around Human and Technology Support for Contact Tracing,,329.mp4,329.srt,https://www.youtube.com/watch?v=d0iNE8Di-1E,N
330,330.0,330.0,330.0,330.0,330.0,,Perverse Downstream Consequences of Debunking: Being Corrected by Another User for Posting False ...,,330.mp4,330.srt,https://www.youtube.com/watch?v=WUDiBiKQxPk,N
331,331.0,331.0,331.0,331.0,331.0,,"CorpSum: Towards an Enabling Tool-Design for Language Researchers to Explore, Analyze and ...",,331.mp4,331.srt,https://www.youtube.com/watch?v=DaoC55VqQDw,N
332,332.0,332.0,332.0,332.0,332.0,,"Effects of Semantic Segmentation Visualization on Trust, Situation Awareness, and Cognitive Load ...",,332.mp4,332.srt,https://www.youtube.com/watch?v=0Ez7PzqGLBs,N
333,333.0,333.0,333.0,333.0,333.0,,"HairTouch: Providing Stiffness, Roughness and Surface Height Differences Using Reconfigurable ...",,333.mp4,333.srt,https://www.youtube.com/watch?v=Ud44WUzDN8o,N
334,334.0,334.0,334.0,334.0,334.0,,ARTEMIS: A Collaborative Mixed-Reality System for Immersive Surgical Telementoring,,334.mp4,334.srt,https://www.youtube.com/watch?v=dk-C5SaLLoY,N
335,335.0,335.0,335.0,335.0,335.0,,Self-E: Smartphone-Supported Guidance for Customizable Self-Experimentation,,335.mp4,335.srt,https://www.youtube.com/watch?v=KQwozp6sOJc,N
336,336.0,336.0,336.0,336.0,336.0,,A Design Space for Privacy Choices: Towards Meaningful Privacy Control in the Internet of Things,,336.mp4,336.srt,https://www.youtube.com/watch?v=aSLMftJTbCY,N
337,337.0,337.0,337.0,337.0,337.0,,Visualizing Examples of Deep Neural Networks at Scale,,337.mp4,337.srt,https://www.youtube.com/watch?v=kU8cBy-0z7Q,N
338,338.0,338.0,338.0,338.0,338.0,,"Sketchnote Components, Design Space Dimensions, and Strategies for Effective Visual Note Taking",,338.mp4,338.srt,https://www.youtube.com/watch?v=9Uym9w4Q5lk,N
339,339.0,339.0,339.0,339.0,339.0,,Classroom Digital Twins with Instrumentation-Free Gaze Tracking,,339.mp4,339.srt,https://www.youtube.com/watch?v=b2Niedr53a4,N
340,340.0,340.0,340.0,340.0,340.0,,Tactile Fixations: A Behavioral Marker on How People with Visual Impairments Explore Raised-line ...,,340.mp4,340.srt,https://www.youtube.com/watch?v=WtBmu3-HNhM,N
341,341.0,341.0,341.0,341.0,341.0,,Reconfiguration Strategies with Composite Data Physicalizations,,341.mp4,341.srt,https://www.youtube.com/watch?v=Q_FFVOxkqbU,N
342,342.0,342.0,342.0,342.0,342.0,,Juicy Haptic Design: Vibrotactile Embellishments Can Improve Player Experience in Games,,342.mp4,342.srt,https://www.youtube.com/watch?v=_n_Sf8pAroA,N
343,343.0,343.0,343.0,343.0,343.0,,Can a Humorous Conversational Agent Enhance Learning Experience and Outcomes?,,343.mp4,343.srt,https://www.youtube.com/watch?v=OhVeA6bPvRE,N
344,344.0,344.0,344.0,344.0,344.0,,Using Intersectional Representation & Embodied Identification in Standard Video Game Play to ...,,344.mp4,344.srt,https://www.youtube.com/watch?v=5oEZWRH1DyY,N
345,345.0,345.0,345.0,345.0,345.0,,Visuo-haptic Illusions for Linear Translation and Stretching using Physical Proxies in Virtual ...,,345.mp4,345.srt,https://www.youtube.com/watch?v=Q5odSUZMHYw,N
346,346.0,346.0,346.0,346.0,346.0,,The Image of the Interface: How People Use Landmarks to Develop Spatial Memory of Commands in ...,,346.mp4,346.srt,https://www.youtube.com/watch?v=pEJ6AuuqLJc,N
347,347.0,347.0,347.0,347.0,347.0,,It Takes More Than One Hand to Clap: On Sustaining Research Results and Co-Designed Artefacts ...,,347.mp4,347.srt,https://www.youtube.com/watch?v=5AoDxV5ySVE,N
348,348.0,348.0,348.0,348.0,348.0,,Azalea: Co-experience in Remote Dialog through Diminished Reality and Somaesthetic Interaction ...,,348.mp4,348.srt,https://www.youtube.com/watch?v=eefroz8oGX8,N
349,349.0,349.0,349.0,349.0,349.0,,Hidden Interaction Techniques: Concealed Information Acquisition and Texting on Smartphones and ...,,349.mp4,349.srt,https://www.youtube.com/watch?v=EtUX3L2JrzE,N
350,350.0,350.0,350.0,350.0,350.0,,Available Anytime Anywhere: Investigating Mobile Volunteer Responders for Out of Hospital ...,,350.mp4,350.srt,https://www.youtube.com/watch?v=CmZc4tWPnGI,N
351,351.0,351.0,351.0,351.0,351.0,,Sharing Heartbeats: Motivations of Citizen Scientists in Times of Crises,,351.mp4,351.srt,https://www.youtube.com/watch?v=oDtU_s-GN-4,N
352,352.0,352.0,352.0,352.0,352.0,,"""Disadvantaged in the American-dominated internet"": Sex, Work, and Technology",,352.mp4,352.srt,https://www.youtube.com/watch?v=lU0xoasBbZI,N
353,353.0,353.0,353.0,353.0,353.0,,AutoDS: Towards Human-Centered Automation of Data Science,,353.mp4,353.srt,https://www.youtube.com/watch?v=yXnUzM22Tps,N
354,354.0,354.0,354.0,354.0,354.0,,“I might be using his.. but it is also mine!”: Ownership & Control in Account Designed for Sharing,,354.mp4,354.srt,https://www.youtube.com/watch?v=TyM9HSvv68g,N
355,355.0,355.0,355.0,355.0,355.0,,SpatialProto: Exploring Real-World Motion Captures for Rapid Prototyping of Interactive Mixed ...,,355.mp4,355.srt,https://www.youtube.com/watch?v=mIOXehNYW0w,N
356,356.0,356.0,356.0,356.0,356.0,,KeyTch: Combining the Keyboard with a Touchscreen for Rapid Command Selection on Toolbars,,356.mp4,356.srt,https://www.youtube.com/watch?v=1Cf7PXiPG_M,N
357,357.0,357.0,357.0,357.0,357.0,,Data Epics: Embarking on Literary Journeys of Home Internet of Things Data,,357.mp4,357.srt,https://www.youtube.com/watch?v=OzOghxXFr2s,N
358,358.0,358.0,358.0,358.0,358.0,,Remote and Collaborative Virtual Reality Experiments via Social VR Platforms,,358.mp4,358.srt,https://www.youtube.com/watch?v=6A8rdLOjaFs,N
359,359.0,359.0,359.0,359.0,359.0,,ToonNote: Improving Communication in Computational Notebooks Using Interactive Data Comics,,359.mp4,359.srt,https://www.youtube.com/watch?v=OAXJFfXpFbM,N
360,360.0,360.0,360.0,360.0,360.0,,We Can Do More to Save Guqin: Design and Evaluate Interactive Systems to Make Guqin More ...,,360.mp4,360.srt,https://www.youtube.com/watch?v=6aYe-0sczSc,N
361,361.0,361.0,361.0,361.0,361.0,,ElectroRing: Subtle Pinch and Touch Detection with a Ring,,361.mp4,361.srt,https://www.youtube.com/watch?v=P5btfdamrq4,N
362,362.0,362.0,362.0,362.0,362.0,,Grandparents and Grandchildren Meeting Online: The Role of Material Things in Remote Settings,,362.mp4,362.srt,https://www.youtube.com/watch?v=0MRIfMvG-Hc,N
363,363.0,363.0,363.0,363.0,363.0,,Crowdsourcing Design Guidance for Contextual Adaptation of Text Content in Augmented Reality,,363.mp4,363.srt,https://www.youtube.com/watch?v=4lXIE3upBOI,N
364,364.0,364.0,364.0,364.0,364.0,,Truth or Dare: Understanding and Predicting How Users Lie and Provide Untruthful Data Online,,364.mp4,364.srt,https://www.youtube.com/watch?v=VkFq4hGn2qY,N
365,365.0,365.0,365.0,365.0,365.0,,Prototyping for Social Wellbeing with Early Social Media Users,,365.mp4,365.srt,https://www.youtube.com/watch?v=xkUblkMyobo,N
366,366.0,366.0,366.0,366.0,366.0,,Neighbourhood Wattch: Using Speculative Design to Explore Values Around Curtailment and Consent ...,,366.mp4,366.srt,https://www.youtube.com/watch?v=teSBpNZUxVE,N
367,367.0,367.0,367.0,367.0,367.0,,When Screen Time Isn’t Screen Time: Tensions and Needs Among Tweens and Their Parents During ...,,367.mp4,367.srt,https://www.youtube.com/watch?v=TSILOpDbipI,N
368,368.0,368.0,368.0,368.0,368.0,,"""It's Complicated"": Negotiating Accessibility and (Mis)Representation in Image Descriptions of ...",,368.mp4,368.srt,https://www.youtube.com/watch?v=7VX7KTS1AQw,N
369,369.0,369.0,369.0,369.0,369.0,,GamesBond: Bimanual Haptic Illusion of Physically Connected Objects for Immersive VR Using Grip ...,,369.mp4,369.srt,https://www.youtube.com/watch?v=YXd-a0asYJ0,N
370,370.0,370.0,370.0,370.0,370.0,,Scene-Aware Behavior Synthesis for Virtual Pets in Mixed Reality,,370.mp4,370.srt,https://www.youtube.com/watch?v=bG1HwIlvxEE,N
371,371.0,371.0,371.0,371.0,371.0,,Integrated Visualization Editing via Parameterized Declarative Templates,,371.mp4,371.srt,https://www.youtube.com/watch?v=0jI6ADaPNdQ,N
372,372.0,372.0,372.0,372.0,372.0,,Including Adults with Severe Intellectual Disabilities in Co-Design through Active Support,,372.mp4,372.srt,https://www.youtube.com/watch?v=23W21Y7VLog,N
373,373.0,373.0,373.0,373.0,373.0,,Distractor Effects on Crossing-Based Interaction,,373.mp4,373.srt,https://www.youtube.com/watch?v=jM_z5xCNJTI,N
374,374.0,374.0,374.0,374.0,374.0,,Vid2Doppler: Synthesizing Doppler Radar Data from Videos for Training Privacy-Preserving ...,,374.mp4,374.srt,https://www.youtube.com/watch?v=IyE9bk2xpxA,N
375,375.0,375.0,375.0,375.0,375.0,,GuideBand: Intuitive 3D Multilevel Force Guidance on a Wristband in Virtual Reality,,375.mp4,375.srt,https://www.youtube.com/watch?v=vgp_uHh79Yk,N
376,376.0,376.0,376.0,376.0,376.0,,XRStudio: A Virtual Production and Live Streaming System for Immersive Instructional Experiences,,376.mp4,376.srt,https://www.youtube.com/watch?v=bYLXVaLTdMo,N
377,377.0,377.0,377.0,377.0,377.0,,KTabulator: Interactive Ad hoc Table Creation Using Knowledge Graphs,,377.mp4,377.srt,https://www.youtube.com/watch?v=dvNGPp5kIdQ,N
378,378.0,378.0,378.0,378.0,378.0,,"""It did not give me an option to decline"": A Longitudinal Analysis of the User Experience of ...",,378.mp4,378.srt,https://www.youtube.com/watch?v=dHWk_T-2pWg,N
379,379.0,379.0,379.0,379.0,379.0,,Identity Claims that Underlie Ethical Awareness and Action,,379.mp4,379.srt,https://www.youtube.com/watch?v=BfxUxjtNGwI,N
380,380.0,380.0,380.0,380.0,380.0,,Assessing the Impact of Automated Suggestions on Decision Making: Domain Experts Mediate Model ...,,380.mp4,380.srt,https://www.youtube.com/watch?v=iqahsetvD58,N
381,381.0,381.0,381.0,381.0,381.0,,ProxiMic: Convenient Voice Activation via Close-to-Mic Speech Detected by a Single Microphone,,381.mp4,381.srt,https://www.youtube.com/watch?v=umO5NUlzbRw,N
382,382.0,382.0,382.0,382.0,382.0,,The U in Crypto Stands for Usable: An Empirical Study of User Experience with Mobile ...,,382.mp4,382.srt,https://www.youtube.com/watch?v=mjTo7u_y_f4,N
383,383.0,383.0,383.0,383.0,383.0,,Unaccompanied Migrant Youth and Mental Health Technologies: A Social-Ecological Approach to ...,,383.mp4,383.srt,https://www.youtube.com/watch?v=3kgrWcEcNeU,N
384,384.0,384.0,384.0,384.0,384.0,,“It's a kind of art!”: Understanding Food Influencers as Influential Content Creators,,384.mp4,384.srt,https://www.youtube.com/watch?v=EcEL9VfiRPk,N
385,385.0,385.0,385.0,385.0,385.0,,"What Do We Mean by ""Accessibility Research""? A Systematic Review of Accessibility Papers in CHI ...",,385.mp4,385.srt,https://www.youtube.com/watch?v=lyeInH6if98,N
386,386.0,386.0,386.0,386.0,386.0,,CapContact: Super-resolution Contact Areas from Capacitive Touchscreens,,386.mp4,386.srt,https://www.youtube.com/watch?v=qtf6u4pJoyA,N
387,387.0,387.0,387.0,387.0,387.0,,A Meta-Analysis of Human Personality and Robot Acceptance in Human-RobotInteraction,,387.mp4,387.srt,https://www.youtube.com/watch?v=nkicvFJfoMs,N
388,388.0,388.0,388.0,388.0,388.0,,Using Job Characteristics to Inform Interface Design for Industrial Maintenance Procedures,,388.mp4,388.srt,https://www.youtube.com/watch?v=yb6SApd7E1I,N
389,389.0,389.0,389.0,389.0,389.0,,Machine Learning Uncertainty as a Design Material: A Post-Phenomenological Inquiry,,389.mp4,389.srt,https://www.youtube.com/watch?v=bnm3XHxvtjY,N
390,390.0,390.0,390.0,390.0,390.0,,You're Making Me Sick: A Systematic Review of How Virtual Reality Research Considers Gender & ...,,390.mp4,390.srt,https://www.youtube.com/watch?v=w8BM7SIjsbg,N
391,391.0,391.0,391.0,391.0,391.0,,"Gathering Self-Report Data in Games through NPC Dialogues: Effects on Data Quality, Data ...",,391.mp4,391.srt,https://www.youtube.com/watch?v=1y5jDBLWLsQ,N
392,392.0,392.0,392.0,392.0,392.0,,Smartphone Usage by Expert Blind Users,,392.mp4,392.srt,https://www.youtube.com/watch?v=Uncl8VfYMY0,N
393,393.0,393.0,393.0,393.0,393.0,,Tactile Compass: Enabling Visually Impaired People to Follow a Path with Continuous Directional ...,,393.mp4,393.srt,https://www.youtube.com/watch?v=esd5_9PWTfU,N
394,394.0,394.0,394.0,394.0,394.0,,Planning for Natural Language Failures with the AI Playbook,,394.mp4,394.srt,https://www.youtube.com/watch?v=0LSpLwVQoJQ,N
395,395.0,395.0,395.0,395.0,395.0,,Exploring Opportunities to Aid Generation of Input Action Ideas for Tangible User Interfaces,,395.mp4,395.srt,https://www.youtube.com/watch?v=feZYiA89fNg,N
396,396.0,396.0,396.0,396.0,396.0,,Radi-Eye: Hands-free Radial Interfaces for 3D Interaction using Gaze-activated Head-crossing,,396.mp4,396.srt,https://www.youtube.com/watch?v=Lctog21e9ME,N
397,397.0,397.0,397.0,397.0,397.0,,Understanding Data Accessibility for People with Intellectual and Developmental Disabilities,,397.mp4,397.srt,https://www.youtube.com/watch?v=LZncJYXRY8U,N
398,398.0,398.0,398.0,398.0,398.0,,Significant Otter: Understanding the Role of Biosignals in Communication,,398.mp4,398.srt,https://www.youtube.com/watch?v=Oub3OY5j7Z8,N
399,399.0,399.0,399.0,399.0,399.0,,What Happens After Death? Using a Design Workbook to Understand User Expectations for Preparing ...,,399.mp4,399.srt,https://www.youtube.com/watch?v=Nvvrj9ut_vw,N
400,400.0,400.0,400.0,400.0,400.0,,Automating Clinical Documentation with Digital Scribes: Understanding the Impact on Physicians,,400.mp4,400.srt,https://www.youtube.com/watch?v=E29QQ7YdHBs,N
401,401.0,401.0,401.0,401.0,401.0,,Does Interaction Improve Bayesian Reasoning with Visualization?,,401.mp4,401.srt,https://www.youtube.com/watch?v=58WFIWHQ2CQ,N
402,402.0,402.0,402.0,402.0,402.0,,"RCEA-360VR: Real-time, Continuous Emotion Annotation in 360° VR Videos for Collecting Precise ...",,402.mp4,402.srt,https://www.youtube.com/watch?v=xZyyNTLjvlc,N
403,403.0,403.0,403.0,403.0,403.0,,RadarNet: Efficient Gesture Recognition Technique Utilizing a Miniaturized Radar Sensor,,403.mp4,403.srt,https://www.youtube.com/watch?v=dxYos6S9UXI,N
404,404.0,404.0,404.0,404.0,404.0,,Disentangling the Motivational Pathways of Recreational Esports Gamblers: A Laddering Study,,404.mp4,404.srt,https://www.youtube.com/watch?v=UtHz4bNhBBM,N
405,405.0,405.0,405.0,405.0,405.0,,On Designing Programming Error Messages for Novices: Readability and its Constituent Factors,,405.mp4,405.srt,https://www.youtube.com/watch?v=sfVUbD0xuUs,N
406,406.0,406.0,406.0,406.0,406.0,,Do Cross-Cultural Differences in Visual Attention Patterns Affect Search Efficiency on Websites?,,406.mp4,406.srt,https://www.youtube.com/watch?v=ASNS1tKxlsU,N
407,407.0,407.0,407.0,407.0,407.0,,Gaze-Supported 3D Object Manipulation in Virtual Reality,,407.mp4,407.srt,https://www.youtube.com/watch?v=m9n4L4YYq7Q,N
408,408.0,408.0,408.0,408.0,408.0,,"Better, Funner, Stronger: A Gameful Approach to Nudge People into Making Less Predictable ...",,408.mp4,408.srt,https://www.youtube.com/watch?v=9TTRBHBeMvo,N
409,409.0,409.0,409.0,409.0,409.0,,Programmable Smart Home Toolkits Should Better Address Households' Social Needs,,409.mp4,409.srt,https://www.youtube.com/watch?v=aI47y41IF8k,N
410,410.0,410.0,410.0,410.0,410.0,,"Watching Myself Watching Birds: Abjection, Ecological Thinking, and Posthuman Design",,410.mp4,410.srt,https://www.youtube.com/watch?v=_LBEVTtY2kc,N
411,411.0,411.0,411.0,411.0,411.0,,From Tactile to NavTile: Opportunities and Challenges for Multi-Modal Feedback in Guiding ...,,411.mp4,411.srt,https://www.youtube.com/watch?v=N-hOSd9KX88,N
412,412.0,412.0,412.0,412.0,412.0,,"Connected Learning, Collapsed Contexts: Examining Teens’ Sociotechnical Ecosystems Through the ...",,412.mp4,412.srt,https://www.youtube.com/watch?v=11Qp0cDFOY4,N
413,413.0,413.0,413.0,413.0,413.0,,“They think it’s totally fine to talk to somebody on the internet they don’t know”: Teachers’ ...,,413.mp4,413.srt,https://www.youtube.com/watch?v=uigu7c5D6vE,N
414,414.0,414.0,414.0,414.0,414.0,,Seeing Beyond Expert Blind Spots: Online Learning Design for Scale and Quality,,414.mp4,414.srt,https://www.youtube.com/watch?v=YbE04OplkH0,N
415,415.0,415.0,415.0,415.0,415.0,,"Bad Breakdowns, Useful Seams, and Face Slapping: Analysis of VR Fails on YouTube",,415.mp4,415.srt,https://www.youtube.com/watch?v=i-opzNeEDG4,N
416,416.0,416.0,416.0,416.0,416.0,,"Security Notifications in Static Analysis Tools: Developers' Attitudes, Comprehension, and ...",,416.mp4,416.srt,https://www.youtube.com/watch?v=VH2rBBl2jLc,N
417,417.0,417.0,417.0,417.0,417.0,,ExplAIn Yourself! Transparency for Positive UX in Autonomous Driving,,417.mp4,417.srt,https://www.youtube.com/watch?v=CFqxFLZFMSs,N
418,418.0,418.0,418.0,418.0,418.0,,HCI Tactics for Politics from Below: Meeting the Challenges of Smart Cities,,418.mp4,418.srt,https://www.youtube.com/watch?v=rnkqMVM0B4M,N
419,419.0,419.0,419.0,419.0,419.0,,LineChaser: A Smartphone-Based Navigation System for Blind People to Stand in Line,,419.mp4,419.srt,https://www.youtube.com/watch?v=HJTam8_Yisw,N
420,420.0,420.0,420.0,420.0,420.0,,RCO : Investigating Social and Technological Constraints through Interactive Dance,,420.mp4,420.srt,https://www.youtube.com/watch?v=tlG37FE6-iE,N
421,421.0,421.0,421.0,421.0,421.0,,The Burden of Survival: How Doctoral Students in Computing Bridge the Chasm of Inaccessibility,,421.mp4,421.srt,https://www.youtube.com/watch?v=ohhXAggqbNc,N
